model;identifier;name;currency;active;inception_date;closing_date;management_company;bank;provider;provider_identifier;type;logo;additional_description
security.models.Security; AtonRâ Biotech basket; AtonRâ Biotech basket;USD;True;2015-03-17;2022-03-28;;;Crédit Agricole (Suisse) SA;27576238.000;SECTYP_STRUC_PROD;;"{""aliases"": {""TELEKURS"": {""additional"": """", ""value"": ""27576238.000""}, ""FINALE"": {""additional"": ""For migration purpose"", ""value"": ""127890""}, ""BLOOMBERG"": {""additional"": """", ""value"": ""TK442911 Corp""}, ""ISIN"": {""additional"": """", ""value"": ""CH0275762380""}}}"
security.models.Security;(GA-AE047) AMERICAN EXPRESS, BRIG;(GA-AE047) AMERICAN EXPRESS, BRIG;EUR;True;2020-01-01;;;;FinaLE Engine;6034983;SECTYP_SECURITY;;"{""aliases"": {""FINALE"": {""additional"": ""For migration purpose"", ""value"": ""6034983""}}}"
security.models.Security;[Call] USD-MXN X-RATE 2014-12-30 13.5;[Call] USDMXN Spot Exchange Rate - Price of 1 USD in MXN 2014-12-30 13.5;MXN;False;2014-09-03;2014-12-30;;;FinaLE Engine;985914;SECTYP_OPTION;;"{""aliases"": {""FINALE"": {""additional"": ""For migration purpose"", ""value"": ""985914""}}}"
security.models.Security;[Call] USD-ZAR X-RATE 2014-12-30 11.25;[Call] USDZAR Spot Exchange Rate - Price of 1 USD in ZAR 2014-12-30 11.25;ZAR;False;2014-09-03;2014-12-30;;;FinaLE Engine;983354;SECTYP_OPTION;;"{""aliases"": {""FINALE"": {""additional"": ""For migration purpose"", ""value"": ""983354""}}}"
security.models.Security;[Call] XAU-USD X-RATE 2014-09-30 1340;[Call] XAUUSD Spot Exchange Rate - Price of 1 XAU in USD 2014-09-30 1340;USD;False;2014-06-18;2014-09-30;;;FinaLE Engine;987920;SECTYP_OPTION;;"{""aliases"": {""FINALE"": {""additional"": ""For migration purpose"", ""value"": ""987920""}}}"
security.models.Security;[Call] XAU-USD X-RATE 2014-09-30 1375;[Call] XAUUSD Spot Exchange Rate - Price of 1 XAU in USD 2014-09-30 1375;USD;False;2020-01-01;2014-09-30;;;FinaLE Engine;987923;SECTYP_OPTION;;"{""aliases"": {""FINALE"": {""additional"": ""For migration purpose"", ""value"": ""987923""}}}"
security.models.Security;[CFD] ACCSYS TECHNOLOGIES PLC;[CFD] ACCSYS TECHNOLOGIES PLC;GBp;True;2020-01-01;;;;FinaLE Engine;779683;SECTYP_CFD;;"{""aliases"": {""FINALE"": {""additional"": ""For migration purpose"", ""value"": ""779683""}}}"
security.models.Security;[CFD] ALCOA INC;[CFD] ALCOA INC;USD;True;2020-01-01;;;;FinaLE Engine;779986;SECTYP_CFD;;"{""aliases"": {""FINALE"": {""additional"": ""For migration purpose"", ""value"": ""779986""}}}"
security.models.Security;[CFD] APPLE INC;[CFD] APPLE INC;USD;True;2020-01-01;;;;FinaLE Engine;782951;SECTYP_CFD;;"{""aliases"": {""FINALE"": {""additional"": ""For migration purpose"", ""value"": ""782951""}}}"
security.models.Security;[CFD] ARCELORMITTAL;[CFD] ARCELORMITTAL;EUR;True;2020-01-01;;;;FinaLE Engine;779557;SECTYP_CFD;;"{""aliases"": {""FINALE"": {""additional"": ""For migration purpose"", ""value"": ""779557""}}}"
security.models.Security;[CFD] AT&T INC;[CFD] AT&T Inc;USD;True;2020-01-01;;;;FinaLE Engine;783018;SECTYP_CFD;;"{""aliases"": {""FINALE"": {""additional"": ""For migration purpose"", ""value"": ""783018""}}}"
security.models.Security;[CFD] AXA SA;[CFD] AXA SA;EUR;True;2020-01-01;;;;FinaLE Engine;783634;SECTYP_CFD;;"{""aliases"": {""FINALE"": {""additional"": ""For migration purpose"", ""value"": ""783634""}}}"
security.models.Security;[CFD] BNP PARIBAS;[CFD] BNP PARIBAS;EUR;True;2020-01-01;;;;FinaLE Engine;953244;SECTYP_CFD;;"{""aliases"": {""FINALE"": {""additional"": ""For migration purpose"", ""value"": ""953244""}}}"
security.models.Security;[CFD] DANONE;[CFD] DANONE;EUR;True;2020-01-01;;;;FinaLE Engine;785250;SECTYP_CFD;;"{""aliases"": {""FINALE"": {""additional"": ""For migration purpose"", ""value"": ""785250""}}}"
security.models.Security;[CFD] EURASIAN RESOURCES GROUP;[CFD] Eurasian Resources Group;USD;True;2020-01-01;;;;FinaLE Engine;842060;SECTYP_CFD;;"{""aliases"": {""FINALE"": {""additional"": ""For migration purpose"", ""value"": ""842060""}}}"
security.models.Security;[CFD] FREEPORT-MCMORAN INC;[CFD] FREEPORT-MCMORAN INC;USD;True;2020-01-01;;;;FinaLE Engine;779990;SECTYP_CFD;;"{""aliases"": {""FINALE"": {""additional"": ""For migration purpose"", ""value"": ""779990""}}}"
security.models.Security;[CFD] GAZPROM OAO-SPON ADR;[CFD] GAZPROM OAO-SPON ADR;EUR;True;2020-01-01;;;;FinaLE Engine;779565;SECTYP_CFD;;"{""aliases"": {""FINALE"": {""additional"": ""For migration purpose"", ""value"": ""779565""}}}"
security.models.Security;[CFD] HALLIBURTON CO;[CFD] HALLIBURTON CO;USD;True;2020-01-01;;;;FinaLE Engine;779975;SECTYP_CFD;;"{""aliases"": {""FINALE"": {""additional"": ""For migration purpose"", ""value"": ""779975""}}}"
security.models.Security;[CFD] INTEL CORP;[CFD] INTEL CORP;USD;True;2020-01-01;;;;FinaLE Engine;784871;SECTYP_CFD;;"{""aliases"": {""FINALE"": {""additional"": ""For migration purpose"", ""value"": ""784871""}}}"
security.models.Security;[CFD] KAZ MINERALS PLC;[CFD] KAZ MINERALS PLC;GBp;True;2020-01-01;;;;FinaLE Engine;787900;SECTYP_CFD;;"{""aliases"": {""FINALE"": {""additional"": ""For migration purpose"", ""value"": ""787900""}}}"
security.models.Security;[CFD] MECHEL-SPONSORED ADR;[CFD] Mechel;USD;True;2020-01-01;;;;FinaLE Engine;856387;SECTYP_CFD;;"{""aliases"": {""FINALE"": {""additional"": ""For migration purpose"", ""value"": ""856387""}}}"
security.models.Security;[CFD] QUALCOMM INC;[CFD] QUALCOMM Inc;USD;True;2020-01-01;;;;FinaLE Engine;784054;SECTYP_CFD;;"{""aliases"": {""FINALE"": {""additional"": ""For migration purpose"", ""value"": ""784054""}}}"
security.models.Security;[CFD] RAPTOR PHARMACEUTICAL CORP;[CFD] Raptor Pharmaceutical Corp;USD;True;2020-01-01;;;;FinaLE Engine;790704;SECTYP_CFD;;"{""aliases"": {""FINALE"": {""additional"": ""For migration purpose"", ""value"": ""790704""}}}"
security.models.Security;[CFD] SCHLUMBERGER LTD;[CFD] Schlumberger Ltd;USD;True;2020-01-01;;;;FinaLE Engine;782827;SECTYP_CFD;;"{""aliases"": {""FINALE"": {""additional"": ""For migration purpose"", ""value"": ""782827""}}}"
security.models.Security;[CFD] SOCIETE GENERALE SA;[CFD] SOCIETE GENERALE SA;EUR;True;2020-01-01;;;;FinaLE Engine;780372;SECTYP_CFD;;"{""aliases"": {""FINALE"": {""additional"": ""For migration purpose"", ""value"": ""780372""}}}"
security.models.Security;[CFD] UBS AG-REG;[CFD] UBS AG-REG;CHF;True;2020-01-01;;;;FinaLE Engine;783791;SECTYP_CFD;;"{""aliases"": {""FINALE"": {""additional"": ""For migration purpose"", ""value"": ""783791""}}}"
security.models.Security;[CFD] VERIZON COMMUNICATIONS INC;[CFD] VERIZON COMMUNICATIONS INC;USD;True;2020-01-01;;;;FinaLE Engine;780478;SECTYP_CFD;;"{""aliases"": {""FINALE"": {""additional"": ""For migration purpose"", ""value"": ""780478""}}}"
security.models.Security;[CFD] VODAFONE GROUP PLC;[CFD] VODAFONE GROUP PLC;GBp;True;2020-01-01;;;;FinaLE Engine;961406;SECTYP_CFD;;"{""aliases"": {""FINALE"": {""additional"": ""For migration purpose"", ""value"": ""961406""}}}"
security.models.Security;[CFD] XAU-USD X-RATE;[CFD] XAUUSD Spot Exchange Rate - Price of 1 XAU in USD;USD;True;2020-01-01;;;;FinaLE Engine;989959;SECTYP_CFD;;"{""aliases"": {""FINALE"": {""additional"": ""For migration purpose"", ""value"": ""989959""}}}"
security.models.Security;October 15 Puts on RPTP US;[PUT] Raptor Pharmaceutical Corp 2015-10;USD;True;2020-01-01;;;;Bloomberg LP;RPTP US 10/16/15 P7 Equity;SECTYP_SECURITY;;"{""aliases"": {""FINALE"": {""additional"": ""For migration purpose"", ""value"": ""451032""}, ""BLOOMBERG"": {""additional"": """", ""value"": ""RPTP US 10/16/15 P7 Equity""}}}"
security.models.Security;0 % SHORTLINE -LPN- 16/49 -TECH-;0 % SHORTLINE -LPN- 16/49 -TECH-;USD;True;2020-01-01;;;;Bloomberg LP;XS1371516268;SECTYP_BOND;;"{""aliases"": {""ISIN"": {""additional"": """", ""value"": ""XS1371516268""}, ""FINALE"": {""additional"": ""For migration purpose"", ""value"": ""5978374""}, ""BLOOMBERG"": {""additional"": """", ""value"": ""XS1371516268""}}}"
security.models.Security;1.2 FUND LTD-EUR;1.2 FUND LTD-EUR;EUR;True;2020-01-01;;;;Bloomberg LP;1P2FUND VI Equity;SECTYP_FUND;;"{""aliases"": {""ISIN"": {""additional"": """", ""value"": ""VGG677711084""}, ""FINALE"": {""additional"": ""For migration purpose"", ""value"": ""124437""}, ""BLOOMBERG"": {""additional"": """", ""value"": ""1P2FUND VI Equity""}}}"
security.models.Security;ASTRAZENECA PLC;1.95% Astrazeneca Plc 2012-18.9.19 Notes Sr;USD;True;2020-01-01;;;;Bloomberg LP;US046353AF58;SECTYP_BOND;;"{""aliases"": {""ISIN"": {""additional"": """", ""value"": ""US046353AF58""}, ""FINALE"": {""additional"": ""For migration purpose"", ""value"": ""6364368""}, ""BLOOMBERG"": {""additional"": """", ""value"": ""US046353AF58""}}}"
security.models.Security;10.20% ER Kick-In Goal BNP 2017-29.12.2017 (ff 21.12.17) CSGN / CFR / ZURN;10.20% ER Kick-In Goal BNP 2017-29.12.2017 (ff 21.12.17) CSGN / CFR / ZURN;CHF;False;2017-03-01;2017-12-29;;;UBS Genève;34970902;SECTYP_BOND;;"{""aliases"": {""ISIN"": {""additional"": """", ""value"": ""XS1447040616""}, ""FINALE"": {""additional"": ""For migration purpose"", ""value"": ""6574869""}, ""UBS"": {""additional"": """", ""value"": ""34970902""}}}"
security.models.Security;10.41 % Kick-In GOAL Vontobel FP 2016-17.04.2017 Netflix/Alphabet-A/Facebook-A;10.41 % Kick-In GOAL Vontobel FP 2016-17.04.2017 Netflix/Alphabet-A/Facebook-A;USD;False;2016-10-07;2017-04-17;;;UBS Genève;33460505;SECTYP_STRUC_PROD;;"{""aliases"": {""ISIN"": {""additional"": """", ""value"": ""CH0334605059""}, ""FINALE"": {""additional"": ""For migration purpose"", ""value"": ""6127515""}, ""BLOOMBERG"": {""additional"": """", ""value"": ""QZ8322138 Corp""}, ""UBS"": {""additional"": """", ""value"": ""33460505""}}}"
security.models.Security;10.56% Trig. Kick-In GOAL Barclays 2017-08.11.2018 NKE/NFLX/DIS;10.56% Trig. Kick-In GOAL Barclays 2017-08.11.2018 NKE/NFLX/DIS;USD;True;2020-01-01;;;;UBS Genève;38542708;SECTYP_BOND;;"{""aliases"": {""ISIN"": {""additional"": """", ""value"": ""CH0385427080""}, ""FINALE"": {""additional"": ""For migration purpose"", ""value"": ""7599539""}, ""UBS"": {""additional"": """", ""value"": ""38542708""}}}"
security.models.Security;100%CGN GOLD(LEHMAN BR.)060311-DE;100%CGN GOLD(LEHMAN BR.)060311-DE;EUR;True;2020-01-01;;;;Swiss-Rev Guardian;132522;SECTYP_BOND;;"{""aliases"": {""ISIN"": {""additional"": """", ""value"": ""XS0351272322""}, ""FINALE"": {""additional"": ""For migration purpose"", ""value"": ""132522""}}}"
security.models.Security;11.11 % Kick-In GOAL Vontobel;11.11 % Kick-In GOAL Vontobel FP 2016-30;EUR;False;2016-05-24;2016-08-30;;;Bloomberg LP;LW1938676 Corp;SECTYP_BOND;;"{""aliases"": {""ISIN"": {""additional"": """", ""value"": ""CH0321511823""}, ""FINALE"": {""additional"": ""For migration purpose"", ""value"": ""6034995""}, ""BLOOMBERG"": {""additional"": """", ""value"": ""LW1938676 Corp""}}}"
security.models.Security;11.11 % Kick-In GOAL Vontobel FP 2016-30.08.2016 CS/BNP/GLE;11.11 % Kick-In GOAL Vontobel FP 2016-30.08.2016 CS/BNP/GLE;EUR;False;2020-01-01;2016-08-30;;;UBS Genève;32151182;SECTYP_BOND;;"{""aliases"": {""ISIN"": {""additional"": """", ""value"": ""CH0321511823""}, ""FINALE"": {""additional"": ""For migration purpose"", ""value"": ""6000769""}, ""UBS"": {""additional"": """", ""value"": ""32151182""}}}"
security.models.Security;12.08 % Kick-In GOAL;12.08 % Kick-In GOAL Vontobel FP 2016-30;EUR;False;2016-05-24;2016-08-30;;;Bloomberg LP;LW1931168 Corp;SECTYP_BOND;;"{""aliases"": {""ISIN"": {""additional"": """", ""value"": ""CH0321511724""}, ""FINALE"": {""additional"": ""For migration purpose"", ""value"": ""6034998""}, ""BLOOMBERG"": {""additional"": """", ""value"": ""LW1931168 Corp""}}}"
security.models.Security;12.08 % Kick-In GOAL Vontobel FP 2016-30.08.2016 CS/BNP/GLE;12.08 % Kick-In GOAL Vontobel FP 2016-30.08.2016 CS/BNP/GLE;EUR;False;2020-01-01;2016-08-30;;;UBS Genève;32151172;SECTYP_BOND;;"{""aliases"": {""ISIN"": {""additional"": """", ""value"": ""CH0321511724""}, ""FINALE"": {""additional"": ""For migration purpose"", ""value"": ""6000797""}, ""UBS"": {""additional"": """", ""value"": ""32151172""}}}"
security.models.Security;13.43 % Kick-In GOAL 29.08.2016;13.43 % Kick-In GOAL Vontobel FP 2016-29;EUR;True;2020-01-01;;;;FinaLE Engine;6035001;SECTYP_BOND;;"{""aliases"": {""FINALE"": {""additional"": ""For migration purpose"", ""value"": ""6035001""}}}"
security.models.Security;13.43 % Kick-In GOAL Vontobel FP 2016-29.08.2016 CS/BNP/GLE;13.43 % Kick-In GOAL Vontobel FP 2016-29.08.2016 CS/BNP/GLE;EUR;False;2020-01-01;2016-08-29;;;UBS Genève;32151133;SECTYP_BOND;;"{""aliases"": {""ISIN"": {""additional"": """", ""value"": ""CH0321511336""}, ""FINALE"": {""additional"": ""For migration purpose"", ""value"": ""6000384""}, ""UBS"": {""additional"": """", ""value"": ""32151133""}}}"
security.models.Security;15.94 % Kick-In GOAL Vontobel FP 2016-22.12.2016 CS/BNP/GLE;15.94 % Kick-In GOAL Vontobel FP 2016-22.12.2016 CS/BNP/GLE;EUR;False;2016-09-16;2016-12-22;;;UBS Genève;33459032;SECTYP_BOND;;"{""aliases"": {""ISIN"": {""additional"": """", ""value"": ""CH0334590327""}, ""FINALE"": {""additional"": ""For migration purpose"", ""value"": ""6090525""}, ""BLOOMBERG"": {""additional"": """", ""value"": ""QZ5752212 Corp""}, ""UBS"": {""additional"": """", ""value"": ""33459032""}}}"
security.models.Security;16.32 % Kick-In GOAL Vontobel FP 2016-21.12.2016 CS/BNP/GLE;16.32 % Kick-In GOAL Vontobel FP 2016-21.12.2016 CS/BNP/GLE;EUR;False;2016-09-15;2016-12-21;;;UBS Genève;33459007;SECTYP_STRUC_PROD;;"{""aliases"": {""ISIN"": {""additional"": """", ""value"": ""CH0334590079""}, ""FINALE"": {""additional"": ""For migration purpose"", ""value"": ""6088493""}, ""BLOOMBERG"": {""additional"": """", ""value"": ""QZ5714568 Corp""}, ""UBS"": {""additional"": """", ""value"": ""33459007""}}}"
security.models.Security;17.19 % Kick-In GOAL Vontobel FP 2016-21.12.2016 BNP/CSGN/GLE Q EUR;17.19 % Kick-In GOAL Vontobel FP 2016-21.12.2016 BNP/CSGN/GLE Q EUR;EUR;False;2016-09-15;2016-12-21;;;UBS Genève;33458944;SECTYP_STRUC_PROD;;"{""aliases"": {""ISIN"": {""additional"": """", ""value"": ""CH0334589444""}, ""FINALE"": {""additional"": ""For migration purpose"", ""value"": ""6088504""}, ""BLOOMBERG"": {""additional"": """", ""value"": ""QZ5608083 Corp""}, ""UBS"": {""additional"": """", ""value"": ""33458944""}}}"
security.models.Security;18% Mozido promissory note 18/4;18% Mozido promissory note 18/4 - 20/08/;USD;True;2020-01-01;;;;Swiss-Rev Guardian;6035003;SECTYP_BOND;;"{""aliases"": {""FINALE"": {""additional"": ""For migration purpose"", ""value"": ""6035003""}}}"
security.models.Security;COOPERATIEVE RABOBANK UA;2.25% Cooperatieve Rabobank UA 2014-02..12.2019 SERIES 2909A;USD;True;2020-01-01;2019-12-02;;;Bloomberg LP;XS1145523137;SECTYP_BOND;;"{""aliases"": {""ISIN"": {""additional"": """", ""value"": ""XS1145523137""}, ""FINALE"": {""additional"": ""For migration purpose"", ""value"": ""6181311""}, ""BLOOMBERG"": {""additional"": """", ""value"": ""XS1145523137""}, ""UBS"": {""additional"": """", ""value"": ""26195284""}}}"
security.models.Security;2.328% Notes Bank of America Corp. 2017-01.10.2021 Fixed/Floating Rate;2.328% Notes Bank of America Corp. 01.10.2021;USD;True;2021-10-01;;;;Bloomberg LP;US06051GGS21;SECTYP_BOND;;"{""aliases"": {""ISIN"": {""additional"": """", ""value"": ""US06051GGS21""}, ""FINALE"": {""additional"": ""For migration purpose"", ""value"": ""7599618""}, ""UBS"": {""additional"": """", ""value"": ""38312658""}}}"
security.models.Security;BNP PARIBAS;2.375% BNP Paribas 2012-14.9.17 Medium Term Notes;USD;False;2020-01-01;2017-09-14;;;Bloomberg LP;US05567L7E16;SECTYP_BOND;;"{""aliases"": {""ISIN"": {""additional"": """", ""value"": ""US05567L7E16""}, ""FINALE"": {""additional"": ""For migration purpose"", ""value"": ""6364352""}, ""BLOOMBERG"": {""additional"": """", ""value"": ""US05567L7E16""}}}"
security.models.Security;DEUTSCHE BANK AG LONDON;2.5% Deutsche Bank AG, London 2014-13.2.19 Notes Senior Series-ATranche 473;USD;True;2020-01-01;2019-02-13;;;Bloomberg LP;US25152RVS92;SECTYP_BOND;;"{""aliases"": {""TELEKURS"": {""additional"": """", ""value"": ""23675783.000""}, ""FINALE"": {""additional"": ""For migration purpose"", ""value"": ""6364376""}, ""BLOOMBERG"": {""additional"": """", ""value"": ""US25152RVS92""}, ""ISIN"": {""additional"": """", ""value"": ""US25152RVS92""}}}"
security.models.Security;BP CAPITAL MARKETS PLC;2.518% BP Capital Markets Plc 2014-16.1.20 Notes Reg-S Series 87;USD;True;2020-01-01;;;;Bloomberg LP;XS1069612122;SECTYP_BOND;;"{""aliases"": {""ISIN"": {""additional"": """", ""value"": ""XS1069612122""}, ""FINALE"": {""additional"": ""For migration purpose"", ""value"": ""6364384""}, ""BLOOMBERG"": {""additional"": """", ""value"": ""XS1069612122""}}}"
security.models.Security;JPMORGAN CHASE & CO;2.55% JPMorgan Chase & Co 2015-29.10.2020;USD;True;2020-01-01;2020-10-29;;;Bloomberg LP;US46625HNX43;SECTYP_BOND;;"{""aliases"": {""ISIN"": {""additional"": """", ""value"": ""US46625HNX43""}, ""FINALE"": {""additional"": ""For migration purpose"", ""value"": ""6592886""}, ""BLOOMBERG"": {""additional"": """", ""value"": ""US46625HNX43""}}}"
security.models.Security;2.85% Structured Note SG Issuer 2016-10.01.2020 CR. iTraxx Eur.Cross.Series 26;2.85% Structured Note SG Issuer 2016-10.01.2020 CR. iTraxx Eur.Cross.Series 26;CHF;True;2020-01-01;2020-01-10;;;UBS Genève;32738464;SECTYP_BOND;;"{""aliases"": {""ISIN"": {""additional"": """", ""value"": ""CH0327384647""}, ""FINALE"": {""additional"": ""For migration purpose"", ""value"": ""6468782""}, ""UBS"": {""additional"": """", ""value"": ""32738464""}}}"
security.models.Security;3 % CHF DOCU UBS Jersey 2016-13.06.2016 ;3 % CHF DOCU UBS Jersey 2016-13.06.2016 ;CHF;True;2020-01-01;;;;Bloomberg LP;FXI101171389;SECTYP_BOND;;"{""aliases"": {""ISIN"": {""additional"": """", ""value"": ""FXI101171389""}, ""FINALE"": {""additional"": ""For migration purpose"", ""value"": ""6035005""}}}"
security.models.Security;3 % CHF DOCU UBS Jersey 2016-13.06.2016 (ff 09.06.16);3 % CHF DOCU UBS Jersey 2016-13.06.2016 (ff 09.06.16);CHF;False;2020-01-01;2016-06-13;;;FinaLE Engine;5990442;SECTYP_BOND;;"{""aliases"": {""ISIN"": {""additional"": """", ""value"": ""FXI101171686""}, ""FINALE"": {""additional"": ""For migration purpose"", ""value"": ""5990442""}, ""UBS"": {""additional"": """", ""value"": ""101171686""}}}"
security.models.Security;3 % EUR DOCU 11.07.2016;3 % EUR DOCU UBS Jersey 2016-11.07.2016;EUR;True;2020-01-01;;;;Bloomberg LP;FXI101175583;SECTYP_BOND;;"{""aliases"": {""ISIN"": {""additional"": """", ""value"": ""FXI101175583""}, ""FINALE"": {""additional"": ""For migration purpose"", ""value"": ""6035008""}}}"
security.models.Security;3 % EUR DOCU UBS Jersey 2016-11.07.2016 (ff 07.07.16);3 % EUR DOCU UBS Jersey 2016-11.07.2016 (ff 07.07.16) EUR/CHF (CHF 1.1003);EUR;False;2020-01-01;2016-07-11;;;UBS Genève;101175583;SECTYP_BOND;;"{""aliases"": {""ISIN"": {""additional"": """", ""value"": ""FXI101175583""}, ""FINALE"": {""additional"": ""For migration purpose"", ""value"": ""6007120""}, ""UBS"": {""additional"": """", ""value"": ""101175583""}}}"
security.models.Security;3 % EUR DOCU UBS Jersey 15.08.2016;3 % EUR DOCU UBS Jersey 2016-15.08.2016;EUR;True;2020-01-01;;;;FinaLE Engine;6035011;SECTYP_BOND;;"{""aliases"": {""FINALE"": {""additional"": ""For migration purpose"", ""value"": ""6035011""}}}"
security.models.Security;3 % EUR DOCU UBS Jersey 2016-15.08.2016 (ff 11.08.16) EUR/CHF (CHF 1.0898);3 % EUR DOCU UBS Jersey 2016-15.08.2016 (ff 11.08.16) EUR/CHF (CHF 1.0898);EUR;False;2020-01-01;2016-08-15;;;UBS Genève;101180070;SECTYP_BOND;;"{""aliases"": {""ISIN"": {""additional"": """", ""value"": ""FXI101180070""}, ""FINALE"": {""additional"": ""For migration purpose"", ""value"": ""6021514""}, ""UBS"": {""additional"": """", ""value"": ""101180070""}}}"
security.models.Security;3 % EUR DOCU UBS Jersey 2016-15.08.2016 (ff 11.08.16) EUR/CHF (CHF 1.0902);3 % EUR DOCU UBS Jersey 2016-15.08.2016 (ff 11.08.16) EUR/CHF (CHF 1.0902);EUR;False;2020-01-01;2016-08-15;;;UBS Genève;101180078;SECTYP_BOND;;"{""aliases"": {""ISIN"": {""additional"": """", ""value"": ""FXI101180078""}, ""FINALE"": {""additional"": ""For migration purpose"", ""value"": ""6021536""}, ""UBS"": {""additional"": """", ""value"": ""101180078""}}}"
security.models.Security;3 % EUR DOCU UBS Jersey 2016-15.08.2016 (ff 11.08.16) EUR/CHF (CHF 1.0907);3 % EUR DOCU UBS Jersey 2016-15.08.2016 (ff 11.08.16) EUR/CHF (CHF 1.0907);EUR;False;2020-01-01;2016-08-15;;;UBS Genève;101180055;SECTYP_BOND;;"{""aliases"": {""ISIN"": {""additional"": """", ""value"": ""FXI101180055""}, ""FINALE"": {""additional"": ""For migration purpose"", ""value"": ""6021402""}, ""UBS"": {""additional"": """", ""value"": ""101180055""}}}"
security.models.Security;3 % EUR DOCU15.08.2016 (CHF 1.0898);3 % EUR DOCU15.08.2016 (CHF 1.0898);EUR;True;2020-01-01;;;;FinaLE Engine;6035013;SECTYP_BOND;;"{""aliases"": {""FINALE"": {""additional"": ""For migration purpose"", ""value"": ""6035013""}}}"
security.models.Security;3 % EUR DOCU15.08.2016 (CHF 1.0902);3 % EUR DOCU15.08.2016 (CHF 1.0902);EUR;True;2020-01-01;;;;FinaLE Engine;6035015;SECTYP_BOND;;"{""aliases"": {""FINALE"": {""additional"": ""For migration purpose"", ""value"": ""6035015""}}}"
security.models.Security;3 % Euro Medium Term Notes K+S Aktiengesellschaft 2012-20.06.2022 Reg S;3 % Euro Medium Term Notes K+S Aktiengesellschaft 2012-20.06.2022 Reg S;EUR;True;2020-01-01;2022-06-20;;;UBS Genève;18823957;SECTYP_STRUC_PROD;;"{""aliases"": {""ISIN"": {""additional"": """", ""value"": ""DE000A1PGZ82""}, ""FINALE"": {""additional"": ""For migration purpose"", ""value"": ""6218389""}, ""LGT"": {""additional"": """", ""value"": ""18823957""}, ""UBS"": {""additional"": """", ""value"": ""18823957""}}}"
security.models.Security;3 % Trig. Kick-In GOAL Barclays 2017-07.06.2018 SMI/ESTX50 EUR P/S&P 500 Q EUR;3 % Trig. Kick-In GOAL Barclays 2017-07.06.2018 SMI/ESTX50 EUR P/S&P 500 Q EUR;EUR;True;2017-06-01;2018-06-07;;;UBS Genève;36827913;SECTYP_STRUC_PROD;;"{""aliases"": {""ISIN"": {""additional"": """", ""value"": ""CH0368279136""}, ""FINALE"": {""additional"": ""For migration purpose"", ""value"": ""6815073""}, ""UBS"": {""additional"": """", ""value"": ""36827913""}}}"
security.models.Security;BANCO BILBAO VIZCAYA ARG;3% Banco Bilbao Vizcaya Argentaria SA 2015-20.10.20 Notes;USD;True;2020-01-01;;;;Bloomberg LP;US05946KAD37;SECTYP_BOND;;"{""aliases"": {""ISIN"": {""additional"": """", ""value"": ""US05946KAD37""}, ""FINALE"": {""additional"": ""For migration purpose"", ""value"": ""6364372""}, ""BLOOMBERG"": {""additional"": """", ""value"": ""US05946KAD37""}}}"
security.models.Security;3% CHF DOCU UBS Jersey 2016-07.04.2016;3% CHF DOCU UBS Jersey 2016-07.04.2016;CHF;False;2016-03-07;2016-07-04;;;UBS Genève;101163340;SECTYP_BOND;;"{""aliases"": {""ISIN"": {""additional"": """", ""value"": ""FXI101163340""}, ""FINALE"": {""additional"": ""For migration purpose"", ""value"": ""5944642""}, ""UBS"": {""additional"": """", ""value"": ""101163340""}}}"
security.models.Security;3% CHF DOCU UBS Jersey 2016-07.04.2016;3% CHF DOCU UBS Jersey 2016-07.04.2016 (KO);CHF;True;2020-01-01;;;;Bloomberg LP;FXI101116334;SECTYP_BOND;;"{""aliases"": {""ISIN"": {""additional"": """", ""value"": ""FXI101116334""}, ""FINALE"": {""additional"": ""For migration purpose"", ""value"": ""6035017""}}}"
security.models.Security;3% CHF DOCU UBS Jersey 2016-09.05.2016;3% CHF DOCU UBS Jersey 2016-09.05.2016;CHF;True;2020-01-01;;;;UBS Genève;101167169;SECTYP_BOND;;"{""aliases"": {""ISIN"": {""additional"": """", ""value"": ""FXI101167169""}, ""FINALE"": {""additional"": ""For migration purpose"", ""value"": ""5969460""}, ""UBS"": {""additional"": """", ""value"": ""101167169""}}}"
security.models.Security;3% CHF DOCU UBS Jersey;3% CHF DOCU UBS Jersey 2016-09.05.2016 (ko);CHF;True;2020-01-01;;;;Bloomberg LP;FXI101167169;SECTYP_BOND;;"{""aliases"": {""ISIN"": {""additional"": """", ""value"": ""FXI101167169""}, ""FINALE"": {""additional"": ""For migration purpose"", ""value"": ""6035020""}}}"
security.models.Security;3% DOCU UBS Jersey 2016-10.06.2016;3% DOCU UBS Jersey 2016-10.06.2016;CHF;False;2020-01-01;2016-06-10;;;UBS Genève;101171202;SECTYP_BOND;;"{""aliases"": {""ISIN"": {""additional"": """", ""value"": ""FXI101171202""}, ""FINALE"": {""additional"": ""For migration purpose"", ""value"": ""5994133""}, ""UBS"": {""additional"": """", ""value"": ""101171202""}}}"
security.models.Security;3.1367 % EUR DOCU 11.07.2016;3.1367 % EUR DOCU UBS Jersey 2016-11.07.;EUR;True;2020-01-01;;;;Bloomberg LP;FXI101175575;SECTYP_BOND;;"{""aliases"": {""ISIN"": {""additional"": """", ""value"": ""FXI101175575""}, ""FINALE"": {""additional"": ""For migration purpose"", ""value"": ""6035026""}}}"
security.models.Security;3.1367 % EUR DOCU UBS Jersey 2016-11.07.2016 (ff 07.07.16);3.1367 % EUR DOCU UBS Jersey 2016-11.07.2016 (ff 07.07.16);EUR;False;2020-01-01;2016-07-11;;;UBS Genève;101175575;SECTYP_BOND;;"{""aliases"": {""ISIN"": {""additional"": """", ""value"": ""FXI101175575""}, ""FINALE"": {""additional"": ""For migration purpose"", ""value"": ""6007115""}, ""UBS"": {""additional"": """", ""value"": ""101175575""}}}"
security.models.Security;3.2278% CHF DOCU UBS 2017-31-10-2017 EUR/CHF 1.1394;3.2278% CHF DOCU UBS 2017-31-10-2017 EUR/CHF 1.1394;CHF;False;2017-09-25;2017-10-27;;;UBS Genève;101228370;SECTYP_BOND;;"{""aliases"": {""ISIN"": {""additional"": """", ""value"": ""FXI101228370""}, ""FINALE"": {""additional"": ""For migration purpose"", ""value"": ""7453822""}, ""UBS"": {""additional"": """", ""value"": ""101228370""}}}"
security.models.Security;3.3233 % EUR DOCU UBS Jersey 2016-29.12.2016 (ff 27.12.16) EUR/CHF (CHF 1.0795);3.3233 % EUR DOCU UBS Jersey 2016-29.12.2016 (ff 27.12.16) EUR/CHF (CHF 1.0795);EUR;False;2016-11-22;2016-12-27;;;Bloomberg LP;FXI101197562;SECTYP_STRUC_PROD;;"{""aliases"": {""ISIN"": {""additional"": """", ""value"": ""FXI101197562""}, ""FINALE"": {""additional"": ""For migration purpose"", ""value"": ""6218378""}, ""UBS"": {""additional"": """", ""value"": ""101197562""}}}"
security.models.Security;3.4233% EUR DOCU UBS JERSEY 2017-06-11-2017;3.4233% EUR DOCU UBS JERSEY 2017-06-11-2017;EUR;False;2017-10-06;2017-11-06;;;UBS Genève;101228981;SECTYP_STRUC_PROD;;"{""aliases"": {""ISIN"": {""additional"": """", ""value"": ""FXI101228981""}, ""FINALE"": {""additional"": ""For migration purpose"", ""value"": ""7495682""}, ""UBS"": {""additional"": """", ""value"": ""101228981""}}}"
security.models.Security;RCI BANQUE SA;3.5% RCI Banque SA 2013-3.4.18 Notes Reg-S Senior;USD;True;2020-01-01;;;;Bloomberg LP;USF48957AB45;SECTYP_BOND;;"{""aliases"": {""ISIN"": {""additional"": """", ""value"": ""USF48957AB45""}, ""FINALE"": {""additional"": ""For migration purpose"", ""value"": ""6364364""}, ""BLOOMBERG"": {""additional"": """", ""value"": ""USF48957AB45""}}}"
security.models.Security;UNITED MEXICAN STATES;3.5% United Mexican States 2014-21.01.21 Medium-Term Notes Tranche 28;USD;True;2020-01-01;;;;Bloomberg LP;US91086QBD97;SECTYP_BOND;;"{""aliases"": {""ISIN"": {""additional"": """", ""value"": ""US91086QBD97""}, ""FINALE"": {""additional"": ""For migration purpose"", ""value"": ""6364348""}, ""BLOOMBERG"": {""additional"": """", ""value"": ""US91086QBD97""}}}"
security.models.Security;3D SYSTEMS CORP;3D SYSTEMS CORP;USD;True;2020-01-01;;;;Bloomberg LP;DDD US Equity;SECTYP_STOCK;;"{""aliases"": {""ISIN"": {""additional"": """", ""value"": ""US88554D2053""}, ""FINALE"": {""additional"": ""For migration purpose"", ""value"": ""124447""}, ""BLOOMBERG"": {""additional"": """", ""value"": ""DDD US Equity""}}}"
security.models.Security;3M CO;3M CO;USD;True;2020-01-01;;;;Bloomberg LP;MMM US Equity;SECTYP_STOCK;;"{""aliases"": {""ISIN"": {""additional"": """", ""value"": ""US88579Y1010""}, ""FINALE"": {""additional"": ""For migration purpose"", ""value"": ""124451""}, ""BLOOMBERG"": {""additional"": """", ""value"": ""MMM US Equity""}}}"
security.models.Security;4 % CHF DOCU UBS Jersey 2016-10.06.2016;4 % CHF DOCU UBS Jersey 2016-10.06.2016;CHF;True;2020-01-01;;;;Swiss-Rev Guardian;6035033;SECTYP_SECURITY;;"{""aliases"": {""ISIN"": {""additional"": """", ""value"": ""FXI101171203""}, ""FINALE"": {""additional"": ""For migration purpose"", ""value"": ""6035033""}}}"
security.models.Security;4 % CHF DOCU UBS Jersey 2016-10.06.2016;4 % CHF DOCU UBS Jersey 2016-10.06.2016 (ff 08.06.16) EUR/CHF;CHF;False;2020-01-01;2016-06-10;;;UBS Genève;101171167;SECTYP_BOND;;"{""aliases"": {""ISIN"": {""additional"": """", ""value"": ""FXI101171167""}, ""FINALE"": {""additional"": ""For migration purpose"", ""value"": ""5984449""}, ""UBS"": {""additional"": """", ""value"": ""101171167""}}}"
security.models.Security;4 % CHF DOCU UBS Jersey 2016 XAU/CHF;4 % CHF DOCU UBS Jersey 2016-10.06.2016 (ff 08.06.16) XAU/CHF;CHF;False;2020-01-01;2016-06-10;;;UBS Genève;101171203;SECTYP_BOND;;"{""aliases"": {""ISIN"": {""additional"": """", ""value"": ""FXI101171203""}, ""FINALE"": {""additional"": ""For migration purpose"", ""value"": ""6000273""}, ""UBS"": {""additional"": """", ""value"": ""101171203""}}}"
security.models.Security;4 % CHF DOCU 2016-11.07.2016;4 % CHF DOCU UBS Jersey 2016-11.07.2016;CHF;True;2020-01-01;;;;Bloomberg LP;FXI101175569;SECTYP_BOND;;"{""aliases"": {""ISIN"": {""additional"": """", ""value"": ""FXI101175569""}, ""FINALE"": {""additional"": ""For migration purpose"", ""value"": ""6035036""}}}"
security.models.Security;4 % CHF DOCU UBS Jersey 2016-11.07.2016 (ff 07.07.16);4 % CHF DOCU UBS Jersey 2016-11.07.2016 (ff 07.07.16) XAU/CHF (CHF 1174.78);CHF;False;2020-01-01;2016-06-11;;;UBS Genève;101175569;SECTYP_BOND;;"{""aliases"": {""ISIN"": {""additional"": """", ""value"": ""FXI101175569""}, ""FINALE"": {""additional"": ""For migration purpose"", ""value"": ""6007110""}, ""UBS"": {""additional"": """", ""value"": ""101175569""}}}"
security.models.Security;4 % CHF DOCU UBS Jersey 2016-28.11.2016 (ff 24.11.16) EUR/CHF (CHF 1.0832);4 % CHF DOCU UBS Jersey 2016-28.11.2016 (ff 24.11.16) EUR/CHF (CHF 1.0832);CHF;True;2020-01-01;;;;UBS Genève;101194084;SECTYP_BOND;;"{""aliases"": {""ISIN"": {""additional"": """", ""value"": ""FXI101194084""}, ""FINALE"": {""additional"": ""For migration purpose"", ""value"": ""6161396""}, ""UBS"": {""additional"": """", ""value"": ""101194084""}}}"
security.models.Security;4 % CHF DOCU UBS Jersey 2016-28.12.2016 (ff 22.12.16) XAU/CHF (CHF 1171);4 % CHF DOCU UBS Jersey 2016-28.12.2016 (ff 22.12.16) XAU/CHF (CHF 1171);CHF;False;2016-11-22;2016-12-22;;;UBS Genève;101197431;SECTYP_STRUC_PROD;;"{""aliases"": {""ISIN"": {""additional"": """", ""value"": ""FXI101197431""}, ""FINALE"": {""additional"": ""For migration purpose"", ""value"": ""6213301""}, ""UBS"": {""additional"": """", ""value"": ""101197431""}}}"
security.models.Security;4 % EUR DOCU UBS Jersey 2017-19.06.2017 (ff 15.06.17) XAU/EUR (EUR 1094.65);4 % EUR DOCU UBS Jersey 2017-19.06.2017 (ff 15.06.17) XAU/EUR (EUR 1094.65);EUR;False;2017-03-01;2017-06-15;;;UBS Genève;101209150;SECTYP_BOND;;"{""aliases"": {""ISIN"": {""additional"": """", ""value"": ""FXI101209150""}, ""FINALE"": {""additional"": ""For migration purpose"", ""value"": ""6545840""}, ""UBS"": {""additional"": """", ""value"": ""101209150""}}}"
security.models.Security;ELECTRICITE DE FRANCE SA;4 1/4% Electricite de France SA 29/01/2013 - OPEN END;EUR;True;2020-01-01;2099-12-31;;;Bloomberg LP;FR0011401736;SECTYP_BOND;;"{""aliases"": {""ISIN"": {""additional"": """", ""value"": ""FR0011401736""}, ""FINALE"": {""additional"": ""For migration purpose"", ""value"": ""6368807""}, ""BLOOMBERG"": {""additional"": """", ""value"": ""FR0011401736""}}}"
security.models.Security;4% 2017-07-12.2017 DCI LINKED TO USD/EUR;4% 2017-07-12.2017 DCI LINKED TO USD/EUR;USD;True;2017-11-03;;;;UBS Genève;4072757;SECTYP_BOND;;"{""aliases"": {""ISIN"": {""additional"": """", ""value"": ""DOCU04072757""}, ""FINALE"": {""additional"": ""For migration purpose"", ""value"": ""7622499""}, ""LGT"": {""additional"": """", ""value"": ""4072757""}, ""UBS"": {""additional"": """", ""value"": ""4072757""}}}"
security.models.Security;4% CHF DOCU UBS Jersey 2016-07.04.2016;4% CHF DOCU UBS Jersey 2016-07.04.2016;CHF;False;2016-03-03;2016-07-07;;;UBS Genève;101163343;SECTYP_BOND;;"{""aliases"": {""ISIN"": {""additional"": """", ""value"": ""FXI101163365""}, ""FINALE"": {""additional"": ""For migration purpose"", ""value"": ""5944742""}, ""UBS"": {""additional"": """", ""value"": ""101163343""}}}"
security.models.Security;4% CHF DOCU UBS Jersey 2016-09.05.2016;4% CHF DOCU UBS Jersey 2016-09.05.2016;CHF;False;2020-01-01;2016-05-09;;;UBS Genève;101167164;SECTYP_BOND;;"{""aliases"": {""ISIN"": {""additional"": """", ""value"": ""FXI101167164""}, ""FINALE"": {""additional"": ""For migration purpose"", ""value"": ""5969456""}, ""UBS"": {""additional"": """", ""value"": ""101167164""}}}"
security.models.Security;4% CHF DOCU UBS Jersey 2016-09.05.2016 (;4% CHF DOCU UBS Jersey 2016-09.05.2016 (;CHF;True;2020-01-01;;;;UBS Genève;FXI101167256;SECTYP_BOND;;"{""aliases"": {""ISIN"": {""additional"": """", ""value"": ""FXI101167256""}, ""FINALE"": {""additional"": ""For migration purpose"", ""value"": ""5978009""}}}"
security.models.Security;4% EUR DOCU UBS JE 2017-12.10.2017 (ff 10.10.17) XAU/EUR (EUR 1041.60);4% EUR DOCU UBS JE 2017-12.10.2017 (ff 10.10.17) XAU/EUR (EUR 1041.60);EUR;False;2017-07-10;2017-10-12;;;UBS Genève;101221297;SECTYP_STRUC_PROD;;"{""aliases"": {""ISIN"": {""additional"": """", ""value"": ""FXI101221297""}, ""FINALE"": {""additional"": ""For migration purpose"", ""value"": ""6988210""}, ""UBS"": {""additional"": """", ""value"": ""101221297""}}}"
security.models.Security;4% USD DOCU UBS JE 2017-04.01.2018 (ff 02.01.18) EUR/USD (USD 1.175);4% USD DOCU UBS JE 2017-04.01.2018 (ff 02.01.18) EUR/USD (USD 1.175);USD;False;2020-01-01;2018-01-04;;;UBS Genève;101233997;SECTYP_BOND;;"{""aliases"": {""ISIN"": {""additional"": """", ""value"": ""FXI101233997""}, ""FINALE"": {""additional"": ""For migration purpose"", ""value"": ""7599534""}, ""UBS"": {""additional"": """", ""value"": ""101233997""}}}"
security.models.Security;4% USD DOCU UBS JE 2017-27.11.2017 (ff 23.11.17) EUR/USD (USD 1.1676);4% USD DOCU UBS JE 2017-27.11.2017 (ff 23.11.17) EUR/USD (USD 1.1676);USD;True;2020-01-01;;;;UBS Genève;101230838;SECTYP_FUND;;"{""aliases"": {""ISIN"": {""additional"": """", ""value"": ""FXI101230838""}, ""FINALE"": {""additional"": ""For migration purpose"", ""value"": ""7599589""}, ""UBS"": {""additional"": """", ""value"": ""101230838""}}}"
security.models.Security;4% USD DOCU UBS JERSEY 2017-27.11.2017 EUR/USD;4% USD DOCU UBS JERSEY 2017-27.11.2017 EUR/USD;USD;True;2017-10-24;;;;UBS Genève;101230751;SECTYP_STRUC_PROD;;"{""aliases"": {""ISIN"": {""additional"": """", ""value"": ""FXI101230751""}, ""FINALE"": {""additional"": ""For migration purpose"", ""value"": ""7500361""}, ""UBS"": {""additional"": """", ""value"": ""101230751""}}}"
security.models.Security;GENERAL MOTORS FINL CO;4,2% General Motors Financial Co Inc 2021-03-01;USD;True;2020-01-01;2021-03-01;;;Bloomberg LP;US37045XBF24;SECTYP_BOND;;"{""aliases"": {""TELEKURS"": {""additional"": """", ""value"": ""31740496.000""}, ""FINALE"": {""additional"": ""For migration purpose"", ""value"": ""6360468""}, ""BLOOMBERG"": {""additional"": """", ""value"": ""US37045XBF24""}, ""LGT"": {""additional"": """", ""value"": ""31740496""}, ""ISIN"": {""additional"": """", ""value"": ""US37045XBF24""}}}"
security.models.Security;4.00% UBS ER WOKIG 2017-24.06.2019 (ff 17.06.19) SX5E / SMI / SPX;4.00% UBS ER WOKIG 2017-24.06.2019 (ff 17.06.19) SX5E / SMI / SPX;EUR;True;2020-01-01;2019-06-24;;;UBS Genève;38955843;SECTYP_FUND;;"{""aliases"": {""ISIN"": {""additional"": """", ""value"": ""CH0389558435""}, ""FINALE"": {""additional"": ""For migration purpose"", ""value"": ""7654662""}, ""LGT"": {""additional"": """", ""value"": ""38955843""}, ""UBS"": {""additional"": """", ""value"": ""38955843""}}}"
security.models.Security;ELECTRICITE DE FRANCE SA;4.6% Eléctricité de France EDF 2010-27.1.20 Notes Global Reg-S Senior;USD;True;2020-01-01;;;;Bloomberg LP;USF2893TAD84;SECTYP_BOND;;"{""aliases"": {""ISIN"": {""additional"": """", ""value"": ""USF2893TAD84""}, ""FINALE"": {""additional"": ""For migration purpose"", ""value"": ""6364380""}, ""BLOOMBERG"": {""additional"": """", ""value"": ""USF2893TAD84""}}}"
security.models.Security;4.625 ABN 18 EMTN [20409469];4.625 ABN 18 EMTN [20409469];AUD;False;2013-01-15;2018-01-15;;;Bloomberg LP;XS0873667744;SECTYP_BOND;;"{""aliases"": {""ISIN"": {""additional"": """", ""value"": ""XS0873667744""}, ""FINALE"": {""additional"": ""For migration purpose"", ""value"": ""6007051""}, ""BLOOMBERG"": {""additional"": """", ""value"": ""XS0873667744""}, ""UBS"": {""additional"": """", ""value"": ""20409469""}}}"
security.models.Security;EMIRATES NBD PJSC;4.625% Emirates NBD PJSC 2012-28.3.17 Euro Medium-Term Notes Senior;USD;True;2020-01-01;;;;Bloomberg LP;XS0765257141;SECTYP_BOND;;"{""aliases"": {""ISIN"": {""additional"": """", ""value"": ""XS0765257141""}, ""FINALE"": {""additional"": ""For migration purpose"", ""value"": ""6364360""}, ""BLOOMBERG"": {""additional"": """", ""value"": ""XS0765257141""}}}"
security.models.Security;MACQUARIE GROUP LTD;4.875% Macquarie Group Ltd 2010-10.8.17 Notes Senior Reg S;USD;True;2020-01-01;;;;Bloomberg LP;US55608KAC99;SECTYP_BOND;;"{""aliases"": {""ISIN"": {""additional"": """", ""value"": ""US55608KAC99""}, ""FINALE"": {""additional"": ""For migration purpose"", ""value"": ""6364356""}, ""BLOOMBERG"": {""additional"": """", ""value"": ""US55608KAC99""}}}"
security.models.Security;4.89 % Kick-In GOAL UBS London 2017-05.05.2017 (ff 27.04.17) F7X (EUR 120.03/90.02);4.89 % Kick-In GOAL UBS London 2017-05.05.2017 (ff 27.04.17) F7X (EUR 120.03/90.02);EUR;False;2017-01-05;2017-04-27;;;UBS Genève;35241341;SECTYP_BOND;;"{""aliases"": {""ISIN"": {""additional"": """", ""value"": ""CH0352413410""}, ""FINALE"": {""additional"": ""For migration purpose"", ""value"": ""6315627""}, ""UBS"": {""additional"": """", ""value"": ""35241341""}}}"
security.models.Security;4.89 % Kick-In GOAL UBS London 2017-05.05.2017 (ff 27.04.17) F7X (EUR 120.20/90.15);4.89 % Kick-In GOAL UBS London 2017-05.05.2017 (ff 27.04.17) F7X (EUR 120.20/90.15);EUR;False;2017-01-05;2017-04-27;;;UBS Genève;35241351;SECTYP_BOND;;"{""aliases"": {""ISIN"": {""additional"": """", ""value"": ""CH0352413519""}, ""FINALE"": {""additional"": ""For migration purpose"", ""value"": ""6315732""}, ""UBS"": {""additional"": """", ""value"": ""35241351""}}}"
security.models.Security;4.98% 2017-23.03.2018 Barrier Reverse SMI/ESTX/SP500;4.98% 2017-23.03.2018 Barrier Reverse SMI/ESTX/SP500;GBP;True;2017-11-01;2018-03-23;;;LGT Bank Genève;CH0385231581;SECTYP_BOND;;"{""aliases"": {""ISIN"": {""additional"": """", ""value"": ""CH0385231581""}, ""FINALE"": {""additional"": ""For migration purpose"", ""value"": ""7630893""}, ""LGT"": {""additional"": """", ""value"": ""38523158""}}}"
security.models.Security;5% EUR DOCU UBS JE 2017-06.12.2017 (ff 04.12.17) EUR/CHF (CHF 1.1633);5% EUR DOCU UBS JE 2017-06.12.2017 (ff 04.12.17) EUR/CHF (CHF 1.1633);EUR;True;2020-01-01;;;;UBS Genève;101231602;SECTYP_BOND;;"{""aliases"": {""ISIN"": {""additional"": """", ""value"": ""FXI101231602""}, ""FINALE"": {""additional"": ""For migration purpose"", ""value"": ""7599393""}, ""UBS"": {""additional"": """", ""value"": ""101231602""}}}"
security.models.Security;5.00% ER Kick-In GOAL SG Issuer 2016-08.09.2017 (ff 01.09.17);5.00% ER Kick-In GOAL SG Issuer 2016-08.09.2017 (ff 01.09.17);CHF;False;2020-01-01;2017-09-09;;;UBS Genève;32333884;SECTYP_BOND;;"{""aliases"": {""ISIN"": {""additional"": """", ""value"": ""CH0323338845""}, ""FINALE"": {""additional"": ""For migration purpose"", ""value"": ""6075812""}, ""UBS"": {""additional"": """", ""value"": ""32333884""}}}"
security.models.Security;5.00% ER Kick-In GOAL UBS 2017-26.06.2018 (ff 19.06.18) NESN / NOVN / ROG;5.00% ER Kick-In GOAL UBS 2017-26.06.2018 (ff 19.06.18) NESN / NOVN / ROG;CHF;True;2017-06-01;2018-06-26;;;UBS Genève;36784733;SECTYP_STRUC_PROD;;"{""aliases"": {""ISIN"": {""additional"": """", ""value"": ""CH0367847339""}, ""FINALE"": {""additional"": ""For migration purpose"", ""value"": ""6897525""}, ""LGT"": {""additional"": """", ""value"": ""36784733""}, ""UBS"": {""additional"": """", ""value"": ""36784733""}}}"
security.models.Security;5.08 % Kick-In GOAL Vontobel FP 2016-17.04.2017 LLY/EL/PFE;5.08 % Kick-In GOAL Vontobel FP 2016-17.04.2017 LLY/EL/PFE;USD;False;2016-10-07;2017-04-17;;;UBS Genève;33460507;SECTYP_STRUC_PROD;;"{""aliases"": {""ISIN"": {""additional"": """", ""value"": ""CH0334605075""}, ""FINALE"": {""additional"": ""For migration purpose"", ""value"": ""6127520""}, ""BLOOMBERG"": {""additional"": """", ""value"": ""QZ8322146 Corp""}, ""UBS"": {""additional"": """", ""value"": ""33460507""}}}"
security.models.Security;JOHNSON & JOHNSON;5.12% Johnson & Johnson 2008-15-07-2018 Notes;USD;True;2020-01-01;2018-07-15;;;Bloomberg LP;US478160AU81;SECTYP_BOND;;"{""aliases"": {""ISIN"": {""additional"": """", ""value"": ""US478160AU81""}, ""FINALE"": {""additional"": ""For migration purpose"", ""value"": ""6181307""}, ""BLOOMBERG"": {""additional"": """", ""value"": ""US478160AU81""}, ""UBS"": {""additional"": """", ""value"": ""4341967""}}}"
security.models.Security;5.15% 2017-06.06.2018 Barrier Reverse Conv on SMI/ESTX50/SP500;5.15% 2017-06.06.2018 Barrier Reverse Conv on SMI/ESTX50/SP500;EUR;True;2017-11-30;;;;UBS Genève;39167815;SECTYP_BOND;;"{""aliases"": {""ISIN"": {""additional"": """", ""value"": ""CH0391678155""}, ""FINALE"": {""additional"": ""For migration purpose"", ""value"": ""7622059""}, ""LGT"": {""additional"": """", ""value"": ""39167815""}, ""UBS"": {""additional"": """", ""value"": ""39167815""}}}"
security.models.Security;5.21 % Kick-In GOAL UBS London 2017-05.05.2017 (ff 27.04.17) F7X (EUR 118.88/89.16);5.21 % Kick-In GOAL UBS London 2017-05.05.2017 (ff 27.04.17) F7X (EUR 118.88/89.16);EUR;False;2017-01-05;2017-04-27;;;UBS Genève;35241384;SECTYP_BOND;;"{""aliases"": {""ISIN"": {""additional"": """", ""value"": ""CH0352413840""}, ""FINALE"": {""additional"": ""For migration purpose"", ""value"": ""6315737""}, ""UBS"": {""additional"": """", ""value"": ""35241384""}}}"
security.models.Security;5.43 % Kick-In London 05.10.2016;5.43 % Kick-In GOAL UBS London 2016-05.1;EUR;True;2020-01-01;;;;Bloomberg LP;CH0329729708;SECTYP_BOND;;"{""aliases"": {""ISIN"": {""additional"": """", ""value"": ""CH0329729708""}, ""FINALE"": {""additional"": ""For migration purpose"", ""value"": ""6035048""}}}"
security.models.Security;5.43 % Kick-In GOAL UBS London 2016-05.10.2016 (ff 28.09.16);5.43 % Kick-In GOAL UBS London 2016-05.10.2016 (ff 28.09.16);EUR;True;2020-01-01;;;;UBS Genève;32972970;SECTYP_BOND;;"{""aliases"": {""ISIN"": {""additional"": """", ""value"": ""CH0329729708""}, ""FINALE"": {""additional"": ""For migration purpose"", ""value"": ""6008945""}, ""UBS"": {""additional"": """", ""value"": ""32972970""}}}"
security.models.Security;5.5116% EUR DOCU UBS 25.10.2017;5.5116% EUR DOCU UBS 25.10.2017;EUR;True;2017-09-21;;;;UBS Genève;FXI101227772;SECTYP_BOND;;"{""aliases"": {""ISIN"": {""additional"": """", ""value"": ""FXI101227772""}, ""FINALE"": {""additional"": ""For migration purpose"", ""value"": ""7432433""}}}"
security.models.Security;5.75 ANGLO 18 FRN [22923374];5.75 ANGLO 18 FRN [22923374];AUD;True;2013-11-27;2018-11-27;;;Bloomberg LP;AU0000AQMHA7;SECTYP_BOND;;"{""aliases"": {""ISIN"": {""additional"": """", ""value"": ""AU0000AQMHA7""}, ""FINALE"": {""additional"": ""For migration purpose"", ""value"": ""6007044""}, ""BLOOMBERG"": {""additional"": """", ""value"": ""AU0000AQMHA7""}, ""UBS"": {""additional"": """", ""value"": ""22923374""}}}"
security.models.Security;TRANSOCEAN INC;6% TRANSOCEAN INC 2018-03-15;USD;True;2020-01-01;2018-03-15;;;Bloomberg LP;US893830AS85;SECTYP_BOND;;"{""aliases"": {""TELEKURS"": {""additional"": """", ""value"": ""3612709.022""}, ""FINALE"": {""additional"": ""For migration purpose"", ""value"": ""6360480""}, ""BLOOMBERG"": {""additional"": """", ""value"": ""US893830AS85""}, ""LGT"": {""additional"": """", ""value"": ""3612709""}, ""ISIN"": {""additional"": """", ""value"": ""US893830AS85""}}}"
security.models.Security;BARCLAYS BANK PLC;6.2% Kick In GOAL BARCLAYS;EUR;True;2020-01-01;;;;UBS Genève;36016160;SECTYP_BOND;;"{""aliases"": {""ISIN"": {""additional"": """", ""value"": ""CH0360161605""}, ""FINALE"": {""additional"": ""For migration purpose"", ""value"": ""7427063""}, ""BLOOMBERG"": {""additional"": """", ""value"": ""CH0360161605""}, ""UBS"": {""additional"": """", ""value"": ""36016160""}}}"
security.models.Security;6.6% Trig. Kick-In GOAL Barclays 2017-10.12.2018 MA/PYPL/V;6.6% Trig. Kick-In GOAL Barclays 2017-10.12.2018 MA/PYPL/V;USD;True;2020-01-01;2018-12-10;;;FinaLE Engine;7599544;SECTYP_BOND;;"{""aliases"": {""ISIN"": {""additional"": """", ""value"": ""CH0385427098""}, ""FINALE"": {""additional"": ""For migration purpose"", ""value"": ""7599544""}, ""UBS"": {""additional"": """", ""value"": ""38542709""}}}"
security.models.Security;KIG MULTI 17/BARC [35118991];7 % Kick-In GOAL Barclays Bank 2017-14.06.2017 ING Group Rg/AXA P/Allianz N [35118991];EUR;False;2017-02-02;2017-06-14;;;UBS Genève;35118991;SECTYP_STRUC_PROD;;"{""aliases"": {""ISIN"": {""additional"": """", ""value"": ""CH0351189912""}, ""FINALE"": {""additional"": ""For migration purpose"", ""value"": ""6416523""}, ""UBS"": {""additional"": """", ""value"": ""35118991""}}}"
security.models.Security;7 % Kick-In GOAL Barclays Bank 2017-14.06.2017 [35118994];7 % Kick-In GOAL Barclays Bank 2017-14.06.2017 ING Group Rg/AXA P/Allianz N [35118994];EUR;True;2020-01-01;;;;UBS Genève;35118994;SECTYP_STRUC_PROD;;"{""aliases"": {""ISIN"": {""additional"": """", ""value"": ""CH0351189946""}, ""FINALE"": {""additional"": ""For migration purpose"", ""value"": ""6429554""}, ""UBS"": {""additional"": """", ""value"": ""35118994""}}}"
security.models.Security;7 % Kick-In GOAL Barclays Bank 2017-14.06.2017 [35118996];7 % Kick-In GOAL Barclays Bank 2017-14.06.2017 ING Group Rg/AXA P/Allianz N [35118996];EUR;False;2017-02-01;2017-06-14;;;UBS Genève;35118996;SECTYP_STRUC_PROD;;"{""aliases"": {""ISIN"": {""additional"": """", ""value"": ""CH0351189961""}, ""FINALE"": {""additional"": ""For migration purpose"", ""value"": ""6429686""}, ""UBS"": {""additional"": """", ""value"": ""35118996""}}}"
security.models.Security;7 % Kick-In GOAL Barclays Bank 2017-14.06.2017 ING Group Rg/AXA P/Allianz N;7 % Kick-In GOAL Barclays Bank 2017-14.06.2017 ING Group Rg/AXA P/Allianz N [35118997];EUR;False;2017-02-01;2017-06-14;;;UBS Genève;35118997;SECTYP_STRUC_PROD;;"{""aliases"": {""ISIN"": {""additional"": """", ""value"": ""CH0351189979""}, ""FINALE"": {""additional"": ""For migration purpose"", ""value"": ""6429572""}, ""UBS"": {""additional"": """", ""value"": ""35118997""}}}"
security.models.Security;7 1/2% Trig. Kick-In GOAL Barclays 2017-12.12.2017 BNP/ACA/GLE;7 1/2% Trig. Kick-In GOAL Barclays 2017-12.12.2017 BNP/ACA/GLE;EUR;False;2020-01-01;2017-12-12;;;UBS Genève;36016889;SECTYP_BOND;;"{""aliases"": {""ISIN"": {""additional"": """", ""value"": ""CH0360168899""}, ""FINALE"": {""additional"": ""For migration purpose"", ""value"": ""6712486""}, ""UBS"": {""additional"": """", ""value"": ""36016889""}}}"
security.models.Security;7 1/2% Trig. Kick-In GOAL Barclays 2017-12.12.2017 DTE/RNO/DG;7 1/2% Trig. Kick-In GOAL Barclays 2017-12.12.2017 DTE/RNO/DG;EUR;False;2020-01-01;2017-12-12;;;UBS Genève;36016886;SECTYP_BOND;;"{""aliases"": {""ISIN"": {""additional"": """", ""value"": ""CH0360168865""}, ""FINALE"": {""additional"": ""For migration purpose"", ""value"": ""6712471""}, ""UBS"": {""additional"": """", ""value"": ""36016886""}}}"
security.models.Security;7 1/2% Trig. Kick-In GOAL Barclays 2017-12.12.2017 Peugeot/AXA/Michelin N;7 1/2% Trig. Kick-In GOAL Barclays 2017-12.12.2017 Peugeot/AXA/Michelin N;EUR;False;2020-01-01;2017-12-12;;;UBS Genève;36016888;SECTYP_BOND;;"{""aliases"": {""ISIN"": {""additional"": """", ""value"": ""CH0360168881""}, ""FINALE"": {""additional"": ""For migration purpose"", ""value"": ""6712481""}, ""UBS"": {""additional"": """", ""value"": ""36016888""}}}"
security.models.Security;7 1/2% Trig. Kick-In GOAL Barclays 2017-13.11.2017 Orange/Bouygues/Saint-Gobain;7 1/2% Trig. Kick-In GOAL Barclays 2017-13.11.2017 Orange/Bouygues/Saint-Gobain;EUR;False;2020-01-01;2017-11-13;;;UBS Genève;36016887;SECTYP_BOND;;"{""aliases"": {""ISIN"": {""additional"": """", ""value"": ""CH0360168873""}, ""FINALE"": {""additional"": ""For migration purpose"", ""value"": ""6712476""}, ""UBS"": {""additional"": """", ""value"": ""36016887""}}}"
security.models.Security;7.0439% EUR DOCU UBS JE 2017-14.09.2017 (ff 12.09.17) EUR/USD (USD 1.18);7.0439% EUR DOCU UBS JE 2017-14.09.2017 (ff 12.09.17) EUR/USD (USD 1.18);EUR;False;2020-01-01;2017-09-14;;;UBS Genève;37819694;SECTYP_BOND;;"{""aliases"": {""ISIN"": {""additional"": """", ""value"": ""CH0378196940""}, ""FINALE"": {""additional"": ""For migration purpose"", ""value"": ""7216450""}, ""UBS"": {""additional"": """", ""value"": ""37819694""}}}"
security.models.Security;7.36 % Trig. Kick-In GOAL Barclays 2017-20.06.2018 HAL/MRO/PXD Q EUR;7.36 % Trig. Kick-In GOAL Barclays 2017-20.06.2018 HAL/MRO/PXD Q EUR;EUR;True;2017-06-01;2018-06-20;;;UBS Genève;36828173;SECTYP_STRUC_PROD;;"{""aliases"": {""ISIN"": {""additional"": """", ""value"": ""CH0368281736""}, ""FINALE"": {""additional"": ""For migration purpose"", ""value"": ""6897746""}, ""LGT"": {""additional"": """", ""value"": ""36828173""}, ""UBS"": {""additional"": """", ""value"": ""36828173""}}}"
security.models.Security;7.56 % Trig. Kick-In GOAL Barclays 2017-21.06.2018 HAL/MRO/PXD Q EUR;7.56 % Trig. Kick-In GOAL Barclays 2017-21.06.2018 HAL/MRO/PXD Q EUR;EUR;True;2017-06-01;2018-06-21;;;UBS Genève;36828184;SECTYP_STRUC_PROD;;"{""aliases"": {""ISIN"": {""additional"": """", ""value"": ""CH0368281843""}, ""FINALE"": {""additional"": ""For migration purpose"", ""value"": ""6897520""}, ""LGT"": {""additional"": """", ""value"": ""36828184""}, ""UBS"": {""additional"": """", ""value"": ""36828184""}}}"
security.models.Security;7.72 % Trig. Kick-In GOAL Barclays 2017-22.06.2018 HAL/MRO/PXD Q EUR;7.72 % Trig. Kick-In GOAL Barclays 2017-22.06.2018 HAL/MRO/PXD Q EUR;EUR;True;2017-06-01;2018-06-22;;;UBS Genève;36828201;SECTYP_STRUC_PROD;;"{""aliases"": {""ISIN"": {""additional"": """", ""value"": ""CH0368282015""}, ""FINALE"": {""additional"": ""For migration purpose"", ""value"": ""6897663""}, ""UBS"": {""additional"": """", ""value"": ""36828201""}}}"
security.models.Security;8% Kick In Barclays;8% Kick In Barclays;EUR;True;2017-05-25;;;;UBS Genève;36645916;SECTYP_BOND;;"{""aliases"": {""ISIN"": {""additional"": """", ""value"": ""CH0366459169""}, ""FINALE"": {""additional"": ""For migration purpose"", ""value"": ""7427490""}, ""UBS"": {""additional"": """", ""value"": ""36645916""}}}"
security.models.Security;8% Kick In GOAL UBS 2017-11-17;8% Kick In GOAL UBS 2017-11-17;EUR;True;2017-05-25;;;;UBS Genève;36645917;SECTYP_BOND;;"{""aliases"": {""ISIN"": {""additional"": """", ""value"": ""CH0366459177""}, ""FINALE"": {""additional"": ""For migration purpose"", ""value"": ""7427578""}, ""UBS"": {""additional"": """", ""value"": ""36645917""}}}"
security.models.Security;8.5436 % USD DOCU UBS Jersey 2016-05.01.2017 (ff 03.01.17) EUR/USD (USD 1.05);8.5436 % USD DOCU UBS Jersey 2016-05.01.2017 (ff 03.01.17) EUR/USD (USD 1.05);USD;False;2016-11-30;2017-01-03;;;UBS Genève;101198099;SECTYP_STRUC_PROD;;"{""aliases"": {""ISIN"": {""additional"": """", ""value"": ""FXI101198099""}, ""FINALE"": {""additional"": ""For migration purpose"", ""value"": ""6229390""}, ""UBS"": {""additional"": """", ""value"": ""101198099""}}}"
security.models.Security;9.2388% USD DOCU UBS 2017-06.10.2017;9.2388% USD DOCU UBS 2017-06.10.2017;USD;False;2017-09-04;2017-10-06;;;UBS Genève;101226068;SECTYP_BOND;;"{""aliases"": {""ISIN"": {""additional"": """", ""value"": ""FXI101226068""}, ""FINALE"": {""additional"": ""For migration purpose"", ""value"": ""7454028""}, ""UBS"": {""additional"": """", ""value"": ""101226068""}}}"
security.models.Security;9.24 % Kick-In GOAL 2016-07.09.2016;9.24 % Kick-In GOAL Vontobel FP 2016-07.;EUR;True;2020-01-01;;;;FinaLE Engine;6035051;SECTYP_FUND;;"{""aliases"": {""FINALE"": {""additional"": ""For migration purpose"", ""value"": ""6035051""}}}"
security.models.Security;9.24 % Kick-In GOAL Vontobel FP 2016-07.09.2016 BNP/ISP/GLE;9.24 % Kick-In GOAL Vontobel FP 2016-07.09.2016 BNP/ISP/GLE;EUR;False;2020-01-01;2016-09-07;;;UBS Genève;32151560;SECTYP_BOND;;"{""aliases"": {""ISIN"": {""additional"": """", ""value"": ""CH0321515600""}, ""FINALE"": {""additional"": ""For migration purpose"", ""value"": ""6006755""}, ""UBS"": {""additional"": """", ""value"": ""32151560""}}}"
security.models.Security;DEUTSCHE BANK AG LONDON ZC 0%;90% CPN on Macro 5 5 Years;EUR;True;2013-03-22;2018-03-22;;;Swiss-Rev Guardian;125335;SECTYP_BOND;;"{""aliases"": {""ISIN"": {""additional"": """", ""value"": ""DE000DE3CKQ5""}, ""FINALE"": {""additional"": ""For migration purpose"", ""value"": ""125335""}, ""BLOOMBERG"": {""additional"": """", ""value"": ""RD823434 Corp""}}}"
security.models.Security;AB-AMERICAN INCOME PT-A2 H;AB-AMERICAN INCOME PT-A2 H;EUR;True;2020-01-01;;;;Bloomberg LP;ABAA2EH LX Equity;SECTYP_FUND;;"{""aliases"": {""ISIN"": {""additional"": """", ""value"": ""LU0592505589""}, ""FINALE"": {""additional"": ""For migration purpose"", ""value"": ""124455""}, ""BLOOMBERG"": {""additional"": """", ""value"": ""ABAA2EH LX Equity""}, ""LGT"": {""additional"": """", ""value"": ""12639039""}, ""UBS"": {""additional"": """", ""value"": ""12639039""}}}"
security.models.Security;ABB FINANCE USA INC 1.625%;ABB FINANCE USA INC 1.625% 08.05.17;USD;False;2012-05-08;2017-05-08;;;Bloomberg LP;EJ168940 Corp;SECTYP_BOND;;"{""aliases"": {""ISIN"": {""additional"": """", ""value"": ""US00037BAA08""}, ""FINALE"": {""additional"": ""For migration purpose"", ""value"": ""124459""}, ""BLOOMBERG"": {""additional"": """", ""value"": ""EJ168940 Corp""}}}"
security.models.Security;ABB LTD-REG;ABB LTD-REG;CHF;True;2020-01-01;;;;Bloomberg LP;ABBN S1 Equity;SECTYP_STOCK;;"{""aliases"": {""ISIN"": {""additional"": """", ""value"": ""CH0012221716""}, ""FINALE"": {""additional"": ""For migration purpose"", ""value"": ""124463""}, ""BLOOMBERG"": {""additional"": """", ""value"": ""ABBN S1 Equity""}, ""LGT"": {""additional"": """", ""value"": ""1222171""}, ""UBS"": {""additional"": """", ""value"": ""1222171""}}}"
security.models.Security;ABB TREASURY CENTER USA 2.5%;ABB TREASURY CENTER USA 2.5% 15.06.16;USD;False;2011-06-17;2016-06-15;;;UBS Genève;13198678;SECTYP_BOND;;"{""aliases"": {""ISIN"": {""additional"": """", ""value"": ""USU00292AA73""}, ""FINALE"": {""additional"": ""For migration purpose"", ""value"": ""124467""}, ""BLOOMBERG"": {""additional"": """", ""value"": ""USU00292AA73""}, ""UBS"": {""additional"": """", ""value"": ""13198678""}}}"
security.models.Security;ABBVIE INC;AbbVie Inc;USD;True;2020-01-01;;;;Bloomberg LP;ABBV US Equity;SECTYP_STOCK;;"{""aliases"": {""ISIN"": {""additional"": """", ""value"": ""US00287Y1091""}, ""FINALE"": {""additional"": ""For migration purpose"", ""value"": ""6125228""}, ""BLOOMBERG"": {""additional"": """", ""value"": ""ABBV US Equity""}}}"
security.models.Security;ABER GL II-EURPN  COV BD-I2A;ABER GL II-EURPN COV BD-I2A;EUR;True;2020-01-01;;;;Bloomberg LP;ABCEI2A LX Equity;SECTYP_FUND;;"{""aliases"": {""ISIN"": {""additional"": """", ""value"": ""LU0513460336""}, ""FINALE"": {""additional"": ""For migration purpose"", ""value"": ""124471""}, ""BLOOMBERG"": {""additional"": """", ""value"": ""ABCEI2A LX Equity""}, ""LGT"": {""additional"": """", ""value"": ""11487306""}}}"
security.models.Security;ABERDEEN GL-ASIA PAC EQ-I€2A;ABERDEEN GL-ASIA PAC EQ-I€2A;EUR;True;2020-01-01;;;;Bloomberg LP;ABAPI2E LX Equity;SECTYP_FUND;;"{""aliases"": {""ISIN"": {""additional"": """", ""value"": ""LU0726980377""}, ""FINALE"": {""additional"": ""For migration purpose"", ""value"": ""124475""}, ""BLOOMBERG"": {""additional"": """", ""value"": ""ABAPI2E LX Equity""}}}"
security.models.Security;ABERDEEN GL-ASIA PAC EQ-A2;Aberdeen Global - Asia Pacific Equity Fund;USD;True;2020-01-01;;;;Bloomberg LP;AETASEI LX Equity;SECTYP_FUND;;"{""aliases"": {""ISIN"": {""additional"": """", ""value"": ""LU0011963245""}, ""FINALE"": {""additional"": ""For migration purpose"", ""value"": ""6277242""}, ""BLOOMBERG"": {""additional"": """", ""value"": ""AETASEI LX Equity""}, ""LGT"": {""additional"": """", ""value"": ""608236""}}}"
security.models.Security;ABERON CAPITAL REG B/CLASS USD;ABERON CAPITAL REG B/CLASS USD;USD;True;2020-01-01;;;;LGT Bank Genève;XD0137212920;SECTYP_FUND;;"{""aliases"": {""ISIN"": {""additional"": """", ""value"": ""XD0137212920""}, ""FINALE"": {""additional"": ""For migration purpose"", ""value"": ""132539""}, ""LGT"": {""additional"": """", ""value"": ""13721292""}}}"
security.models.Security;ABERON CAPITAL REG. A/CLASS USD;ABERON CAPITAL REG. A/CLASS USD;USD;True;2020-01-01;;;;LGT Bank Genève;QT0106333211;SECTYP_FUND;;"{""aliases"": {""ISIN"": {""additional"": """", ""value"": ""QT0106333211""}, ""FINALE"": {""additional"": ""For migration purpose"", ""value"": ""132536""}, ""LGT"": {""additional"": """", ""value"": ""10633321""}}}"
security.models.Security;ABERTIS INFRAESTRUCTURAS SA;Abertis Infraestructuras SA;EUR;True;2020-01-01;;;;Bloomberg LP;ABE SM Equity;SECTYP_STOCK;;"{""aliases"": {""ISIN"": {""additional"": """", ""value"": ""ES0111845014""}, ""FINALE"": {""additional"": ""For migration purpose"", ""value"": ""7434730""}, ""BLOOMBERG"": {""additional"": """", ""value"": ""ABE SM Equity""}, ""LGT"": {""additional"": """", ""value"": ""1459044""}}}"
security.models.Security;ABN AMRO BANK NV 2.45%;ABN AMRO BANK NV 2.45% 04.06.20;USD;True;2015-06-04;2020-06-04;;;Bloomberg LP;EK945313 Corp;SECTYP_BOND;;"{""aliases"": {""ISIN"": {""additional"": """", ""value"": ""XS1241945473""}, ""FINALE"": {""additional"": ""For migration purpose"", ""value"": ""6035065""}, ""BLOOMBERG"": {""additional"": """", ""value"": ""EK945313 Corp""}}}"
security.models.Security;ABN AMRO BANK NV 4.25%;ABN AMRO BANK NV 4.25% 02.02.17;USD;False;2012-02-02;2017-02-02;;;Bloomberg LP;EJ006479 Corp;SECTYP_BOND;;"{""aliases"": {""ISIN"": {""additional"": """", ""value"": ""XS0741962681""}, ""FINALE"": {""additional"": ""For migration purpose"", ""value"": ""124485""}, ""BLOOMBERG"": {""additional"": """", ""value"": ""EJ006479 Corp""}}}"
security.models.Security;ABN AMRO BANK NV 4.625%;ABN AMRO BANK NV 4.625% 15.01.18;AUD;False;2013-01-15;2018-01-15;;;Bloomberg LP;EJ504766 Corp;SECTYP_BOND;;"{""aliases"": {""ISIN"": {""additional"": """", ""value"": ""XS0873667744""}, ""FINALE"": {""additional"": ""For migration purpose"", ""value"": ""6035070""}, ""BLOOMBERG"": {""additional"": """", ""value"": ""EJ504766 Corp""}}}"
security.models.Security;ACADIA PHARMACEUTICALS INC;ACADIA Pharmaceuticals Inc;USD;True;2020-01-01;;;;Bloomberg LP;ACAD US Equity;SECTYP_STOCK;;"{""aliases"": {""ISIN"": {""additional"": """", ""value"": ""US0042251084""}, ""FINALE"": {""additional"": ""For migration purpose"", ""value"": ""6145201""}, ""BLOOMBERG"": {""additional"": """", ""value"": ""ACAD US Equity""}}}"
security.models.Security;ACANTHE DEVELOPPEMENT SA;Acanthe Developpement SA;EUR;True;2020-01-01;;;;Bloomberg LP;ACAN FP Equity;SECTYP_SECURITY;;"{""aliases"": {""ISIN"": {""additional"": """", ""value"": ""FR0000064602""}, ""FINALE"": {""additional"": ""For migration purpose"", ""value"": ""7433307""}, ""BLOOMBERG"": {""additional"": """", ""value"": ""ACAN FP Equity""}}}"
security.models.Security;ACCOR OR RTS 17 [35916650];ACCOR OR RTS 17 [35916650];EUR;True;2020-01-01;;;;Bloomberg LP;FR0000120404;SECTYP_STOCK;;"{""aliases"": {""ISIN"": {""additional"": """", ""value"": ""FR0000120404""}, ""FINALE"": {""additional"": ""For migration purpose"", ""value"": ""6745413""}, ""UBS"": {""additional"": """", ""value"": ""35916650""}}}"
security.models.Security;ACCOR RTS 16 [31652691];ACCOR RTS 16 [31652691];EUR;True;2020-01-01;;;;Bloomberg LP;1398452D FP Equity;SECTYP_SECURITY;;"{""aliases"": {""ISIN"": {""additional"": """", ""value"": ""FR0013142601""}, ""FINALE"": {""additional"": ""For migration purpose"", ""value"": ""6000293""}, ""BLOOMBERG"": {""additional"": """", ""value"": ""1398452D FP Equity""}, ""UBS"": {""additional"": """", ""value"": ""31652691""}}}"
security.models.Security;ACCOR SA;Accor SA;EUR;True;2020-01-01;;;;Bloomberg LP;AC FP Equity;SECTYP_STOCK;;"{""aliases"": {""ISIN"": {""additional"": """", ""value"": ""FR0000120404""}, ""FINALE"": {""additional"": ""For migration purpose"", ""value"": ""613023""}, ""BLOOMBERG"": {""additional"": """", ""value"": ""AC FP Equity""}, ""LGT"": {""additional"": """", ""value"": ""485822""}, ""UBS"": {""additional"": """", ""value"": ""485822""}}}"
security.models.Security;ACCOR SA;Accor SA [ACRFF US];USD;True;2020-01-01;;;;Bloomberg LP;ACRFF US Equity;SECTYP_STOCK;;"{""aliases"": {""ISIN"": {""additional"": """", ""value"": ""FR0000120404""}, ""FINALE"": {""additional"": ""For migration purpose"", ""value"": ""613027""}, ""BLOOMBERG"": {""additional"": """", ""value"": ""ACRFF US Equity""}}}"
security.models.Security;ACCSYS TECHNOLOGIES PLC;ACCSYS TECHNOLOGIES PLC;GBp;True;2020-01-01;;;;Bloomberg LP;AXS LN Equity;SECTYP_STOCK;;"{""aliases"": {""ISIN"": {""additional"": """", ""value"": ""GB00BQQFX454""}, ""FINALE"": {""additional"": ""For migration purpose"", ""value"": ""124492""}, ""BLOOMBERG"": {""additional"": """", ""value"": ""AXS LN Equity""}}}"
security.models.Security;ACCSYS TECHNOLOGIES PLC [EUR];ACCSYS TECHNOLOGIES PLC [EUR];EUR;True;2020-01-01;;;;Bloomberg LP;AXS NA Equity;SECTYP_STOCK;;"{""aliases"": {""ISIN"": {""additional"": """", ""value"": ""GB00BQQFX454""}, ""FINALE"": {""additional"": ""For migration purpose"", ""value"": ""955355""}, ""BLOOMBERG"": {""additional"": """", ""value"": ""AXS NA Equity""}}}"
security.models.Security;ACTELION LTD-REG;ACTELION LTD-REG;CHF;True;2020-01-01;;;;Bloomberg LP;ATLN VX Equity;SECTYP_STOCK;;"{""aliases"": {""ISIN"": {""additional"": """", ""value"": ""CH0010532478""}, ""FINALE"": {""additional"": ""For migration purpose"", ""value"": ""124500""}, ""BLOOMBERG"": {""additional"": """", ""value"": ""ATLN VX Equity""}}}"
security.models.Security;ACTION TEST;ACTION TEST;AUD;True;2020-01-01;;;;FinaLE Engine;132549;SECTYP_SECURITY;;"{""aliases"": {""FINALE"": {""additional"": ""For migration purpose"", ""value"": ""132549""}}}"
security.models.Security;ADDEX THERAPEUTICS LTD;ADDEX THERAPEUTICS LTD;CHF;True;2020-01-01;;;;Bloomberg LP;ADXN SW Equity;SECTYP_STOCK;;"{""aliases"": {""ISIN"": {""additional"": """", ""value"": ""CH0029850754""}, ""FINALE"": {""additional"": ""For migration purpose"", ""value"": ""124506""}, ""BLOOMBERG"": {""additional"": """", ""value"": ""ADXN SW Equity""}}}"
security.models.Security;ADECCO SA-REG;ADECCO SA-REG;CHF;True;2020-01-01;;;;Bloomberg LP;ADEN VX Equity;SECTYP_STOCK;;"{""aliases"": {""ISIN"": {""additional"": """", ""value"": ""CH0012138605""}, ""FINALE"": {""additional"": ""For migration purpose"", ""value"": ""124510""}, ""BLOOMBERG"": {""additional"": """", ""value"": ""ADEN VX Equity""}}}"
security.models.Security;ADIDAS AG;ADIDAS AG;EUR;True;2020-01-01;;;;Bloomberg LP;ADS GY Equity;SECTYP_STOCK;;"{""aliases"": {""ISIN"": {""additional"": """", ""value"": ""DE000A1EWWW0""}, ""FINALE"": {""additional"": ""For migration purpose"", ""value"": ""124514""}, ""BLOOMBERG"": {""additional"": """", ""value"": ""ADS GY Equity""}}}"
security.models.Security;ADVANCED CANNABIS SOLUTIONS;ADVANCED CANNABIS SOLUTIONS;USD;True;2020-01-01;;;;Bloomberg LP;CANN US Equity;SECTYP_STOCK;;"{""aliases"": {""ISIN"": {""additional"": """", ""value"": ""US00750W1018""}, ""FINALE"": {""additional"": ""For migration purpose"", ""value"": ""124518""}, ""BLOOMBERG"": {""additional"": """", ""value"": ""CANN US Equity""}}}"
security.models.Security;ADVANCED MICRO DEVICES;Advanced Micro Devices Inc;USD;True;2020-01-01;;;;Bloomberg LP;AMD US Equity;SECTYP_STOCK;;"{""aliases"": {""ISIN"": {""additional"": """", ""value"": ""US0079031078""}, ""FINALE"": {""additional"": ""For migration purpose"", ""value"": ""6749657""}, ""BLOOMBERG"": {""additional"": """", ""value"": ""AMD US Equity""}, ""UBS"": {""additional"": """", ""value"": ""903491""}}}"
security.models.Security;AIR CHINA LTD-SPONSORED-ADR;AIR CHINA LTD-SPONSORED-ADR;USD;True;2020-01-01;;;;Bloomberg LP;AIRYY US Equity;SECTYP_STOCK;;"{""aliases"": {""ISIN"": {""additional"": """", ""value"": ""US00910M1009""}, ""FINALE"": {""additional"": ""For migration purpose"", ""value"": ""124522""}, ""BLOOMBERG"": {""additional"": """", ""value"": ""AIRYY US Equity""}, ""UBS"": {""additional"": """", ""value"": ""2616402""}}}"
security.models.Security;AIR FRANCE-KLM;AIR FRANCE-KLM;EUR;True;2020-01-01;;;;Bloomberg LP;AF EU Equity;SECTYP_STOCK;;"{""aliases"": {""ISIN"": {""additional"": """", ""value"": ""FR0000031122""}, ""FINALE"": {""additional"": ""For migration purpose"", ""value"": ""124526""}, ""BLOOMBERG"": {""additional"": """", ""value"": ""AF EU Equity""}, ""UBS"": {""additional"": """", ""value"": ""62461""}}}"
security.models.Security;AIR FRANCE-KLM 3.875%;AIR FRANCE-KLM 3.875% 18.06.21;EUR;True;2014-06-18;2021-06-18;;;Bloomberg LP;EK309806 Corp;SECTYP_BOND;;"{""aliases"": {""ISIN"": {""additional"": """", ""value"": ""FR0011965177""}, ""FINALE"": {""additional"": ""For migration purpose"", ""value"": ""124530""}, ""BLOOMBERG"": {""additional"": """", ""value"": ""EK309806 Corp""}, ""LGT"": {""additional"": """", ""value"": ""24633097""}, ""UBS"": {""additional"": """", ""value"": ""24633097""}}}"
security.models.Security;AIR FRANCE-KLM 6.25%;AIR FRANCE-KLM 6.25% 18.01.18;EUR;False;2012-12-14;2018-01-18;;;Bloomberg LP;EJ473486 Corp;SECTYP_BOND;;"{""aliases"": {""ISIN"": {""additional"": """", ""value"": ""FR0011374099""}, ""FINALE"": {""additional"": ""For migration purpose"", ""value"": ""124534""}, ""BLOOMBERG"": {""additional"": """", ""value"": ""EJ473486 Corp""}}}"
security.models.Security;AIR LIQUIDE SA;AIR LIQUIDE SA;EUR;True;2020-01-01;;;;Bloomberg LP;AI FP Equity;SECTYP_STOCK;;"{""aliases"": {""ISIN"": {""additional"": """", ""value"": ""FR0000120073""}, ""FINALE"": {""additional"": ""For migration purpose"", ""value"": ""124538""}, ""BLOOMBERG"": {""additional"": """", ""value"": ""AI FP Equity""}}}"
security.models.Security;AIR LIQUIDE SA-RTS;AIR LIQUIDE SA-RTS;EUR;True;2020-01-01;;;;Bloomberg LP;AIDS FP Equity;SECTYP_STOCK;;"{""aliases"": {""ISIN"": {""additional"": """", ""value"": ""FR0013201381""}, ""FINALE"": {""additional"": ""For migration purpose"", ""value"": ""6096552""}, ""BLOOMBERG"": {""additional"": """", ""value"": ""AIDS FP Equity""}}}"
security.models.Security;AIRBUS GROUP FINANCE BV 2.7%;AIRBUS GROUP FINANCE BV 2.7% 17.04.23;USD;True;2013-04-17;2023-04-17;;;Bloomberg LP;EJ630701 Corp;SECTYP_BOND;;"{""aliases"": {""ISIN"": {""additional"": """", ""value"": ""USN2823BBD21""}, ""FINALE"": {""additional"": ""For migration purpose"", ""value"": ""124542""}, ""BLOOMBERG"": {""additional"": """", ""value"": ""EJ630701 Corp""}}}"
security.models.Security;AIRBUS GROUP NV;AIRBUS GROUP NV;EUR;True;2020-01-01;;;;Bloomberg LP;AIR FP Equity;SECTYP_STOCK;;"{""aliases"": {""ISIN"": {""additional"": """", ""value"": ""NL0000235190""}, ""FINALE"": {""additional"": ""For migration purpose"", ""value"": ""124546""}, ""BLOOMBERG"": {""additional"": """", ""value"": ""AIR FP Equity""}, ""LGT"": {""additional"": """", ""value"": ""1095306""}, ""UBS"": {""additional"": """", ""value"": ""1095306""}}}"
security.models.Security;ALBATROS PERF SICAV-DIVERSIF;ALBATROS PERF SICAV-DIVERSIF;EUR;True;2020-01-01;;;;Bloomberg LP;ALBPDIV LX Equity;SECTYP_FUND;;"{""aliases"": {""ISIN"": {""additional"": """", ""value"": ""LU0140950048""}, ""FINALE"": {""additional"": ""For migration purpose"", ""value"": ""124554""}, ""BLOOMBERG"": {""additional"": """", ""value"": ""ALBPDIV LX Equity""}}}"
security.models.Security;ALBATROS PERF SICAV-DIVERSIF - TO RECEIV;ALBATROS PERF SICAV-DIVERSIF - TO RECEIV;EUR;True;2020-01-01;;;;Bloomberg LP;ZZ0140950048;SECTYP_FUND;;"{""aliases"": {""ISIN"": {""additional"": """", ""value"": ""ZZ0140950048""}, ""FINALE"": {""additional"": ""For migration purpose"", ""value"": ""6035101""}}}"
security.models.Security;ALCATEL-LUCENT-SPONSORED ADR;ALCATEL-LUCENT-SPONSORED ADR;USD;True;2020-01-01;;;;Bloomberg LP;ALU US Equity;SECTYP_STOCK;;"{""aliases"": {""ISIN"": {""additional"": """", ""value"": ""US0139043055""}, ""FINALE"": {""additional"": ""For migration purpose"", ""value"": ""124561""}, ""BLOOMBERG"": {""additional"": """", ""value"": ""ALU US Equity""}}}"
security.models.Security;ALCOA INC;ALCOA INC;USD;True;2020-01-01;;;;Bloomberg LP;AA US Equity;SECTYP_STOCK;;"{""aliases"": {""ISIN"": {""additional"": """", ""value"": ""US0138171014""}, ""FINALE"": {""additional"": ""For migration purpose"", ""value"": ""124565""}, ""BLOOMBERG"": {""additional"": """", ""value"": ""AA US Equity""}}}"
security.models.Security;ALEXION PHARMACEUTICALS INC;Alexion Pharmaceuticals Inc;USD;True;2020-01-01;;;;Bloomberg LP;ALXN US Equity;SECTYP_STOCK;;"{""aliases"": {""ISIN"": {""additional"": """", ""value"": ""US0153511094""}, ""FINALE"": {""additional"": ""For migration purpose"", ""value"": ""546495""}, ""BLOOMBERG"": {""additional"": """", ""value"": ""ALXN US Equity""}}}"
security.models.Security;ALFA BANK (ALFA BOND) TV 6.3%;ALFA BANK (ALFA BOND) TV 6.3% 22.02.17;USD;False;2007-02-22;2017-02-22;;;Bloomberg LP;EG205242 Corp;SECTYP_BOND;;"{""aliases"": {""ISIN"": {""additional"": """", ""value"": ""XS0288690539""}, ""FINALE"": {""additional"": ""For migration purpose"", ""value"": ""124569""}, ""BLOOMBERG"": {""additional"": """", ""value"": ""EG205242 Corp""}}}"
security.models.Security;ALIBABA GROUP HOLDING-SP ADR;ALIBABA GROUP HOLDING-SP ADR;USD;True;2020-01-01;;;;Bloomberg LP;BABA US Equity;SECTYP_STOCK;;"{""aliases"": {""ISIN"": {""additional"": """", ""value"": ""US01609W1027""}, ""FINALE"": {""additional"": ""For migration purpose"", ""value"": ""124573""}, ""BLOOMBERG"": {""additional"": """", ""value"": ""BABA US Equity""}, ""LGT"": {""additional"": """", ""value"": ""24409862""}, ""UBS"": {""additional"": """", ""value"": ""24409862""}}}"
security.models.Security;ALKEN FUND-ABSOL RET EUR-EU1;ALKEN FUND-ABSOL RET EUR-EU1;EUR;True;2020-01-01;;;;Bloomberg LP;ALKAEU1 LX Equity;SECTYP_FUND;;"{""aliases"": {""ISIN"": {""additional"": """", ""value"": ""LU0866838229""}, ""FINALE"": {""additional"": ""For migration purpose"", ""value"": ""124577""}, ""BLOOMBERG"": {""additional"": """", ""value"": ""ALKAEU1 LX Equity""}}}"
security.models.Security;ALKEN FUND-ABSOL RET EUROP-I;ALKEN FUND-ABSOL RET EUROP-I;EUR;True;2020-01-01;;;;Bloomberg LP;ALKAREI LX Equity;SECTYP_FUND;;"{""aliases"": {""ISIN"": {""additional"": """", ""value"": ""LU0572586674""}, ""FINALE"": {""additional"": ""For migration purpose"", ""value"": ""124581""}, ""BLOOMBERG"": {""additional"": """", ""value"": ""ALKAREI LX Equity""}, ""LGT"": {""additional"": """", ""value"": ""12171927""}}}"
security.models.Security;ALLEGRO INVEST CORP SA ZC 0%;ALLEGRO INVEST CORP SA ZC 0% 05.04.10;USD;False;2008-04-03;2010-04-05;;;Swiss-Rev Guardian;124585;SECTYP_BOND;;"{""aliases"": {""ISIN"": {""additional"": """", ""value"": ""XS0355418962""}, ""FINALE"": {""additional"": ""For migration purpose"", ""value"": ""124585""}, ""BLOOMBERG"": {""additional"": """", ""value"": ""EH296522 Corp""}}}"
security.models.Security;ALLIANCE OIL CO LTD 9.875%;ALLIANCE OIL CO LTD 9.875% 11.03.15;USD;True;2010-03-11;2019-03-11;;;Bloomberg LP;EI178316 Corp;SECTYP_BOND;;"{""aliases"": {""TELEKURS"": {""additional"": """", ""value"": ""11104829.000""}, ""FINALE"": {""additional"": ""For migration purpose"", ""value"": ""124589""}, ""BLOOMBERG"": {""additional"": """", ""value"": ""EI178316 Corp""}, ""ISIN"": {""additional"": """", ""value"": ""XS0493579238""}}}"
security.models.Security;ALLIANZ EUR EQY DIV-AT;ALLIANZ EUR EQY DIV-AT;EUR;True;2020-01-01;;;;Bloomberg LP;ARCMEAT LX Equity;SECTYP_FUND;;"{""aliases"": {""ISIN"": {""additional"": """", ""value"": ""LU0414045822""}, ""FINALE"": {""additional"": ""For migration purpose"", ""value"": ""124593""}, ""BLOOMBERG"": {""additional"": """", ""value"": ""ARCMEAT LX Equity""}}}"
security.models.Security;ALLIANZ EUR EQY DIV-P;ALLIANZ EUR EQY DIV-P;EUR;True;2020-01-01;;;;Bloomberg LP;ALEEDVP LX Equity;SECTYP_FUND;;"{""aliases"": {""ISIN"": {""additional"": """", ""value"": ""LU0857590946""}, ""FINALE"": {""additional"": ""For migration purpose"", ""value"": ""124597""}, ""BLOOMBERG"": {""additional"": """", ""value"": ""ALEEDVP LX Equity""}}}"
security.models.Security;ALLIANZ EUROLD EQY GROW-A;Allianz Euroland Equity Growth;EUR;True;2020-01-01;;;;Bloomberg LP;RCMEEGA LX Equity;SECTYP_FUND;;"{""aliases"": {""ISIN"": {""additional"": """", ""value"": ""LU0256839944""}, ""FINALE"": {""additional"": ""For migration purpose"", ""value"": ""6592806""}, ""BLOOMBERG"": {""additional"": """", ""value"": ""RCMEEGA LX Equity""}}}"
security.models.Security;ALLIANZ EURP EQ GRW-AT H2USD;Allianz Europe Equity Growth;USD;True;2020-01-01;;;;Bloomberg LP;RCMEATU LX Equity;SECTYP_FUND;;"{""aliases"": {""TELEKURS"": {""additional"": """", ""value"": ""20103638.000""}, ""FINALE"": {""additional"": ""For migration purpose"", ""value"": ""6277828""}, ""BLOOMBERG"": {""additional"": """", ""value"": ""RCMEATU LX Equity""}, ""ISIN"": {""additional"": """", ""value"": ""LU0857590862""}}}"
security.models.Security;ALLIANZ EURP EQY GRWTH-A;ALLIANZ EURP EQY GRWTH-A;EUR;True;2020-01-01;;;;Bloomberg LP;RCMEUGA LX Equity;SECTYP_FUND;;"{""aliases"": {""ISIN"": {""additional"": """", ""value"": ""LU0256839191""}, ""FINALE"": {""additional"": ""For migration purpose"", ""value"": ""124601""}, ""BLOOMBERG"": {""additional"": """", ""value"": ""RCMEUGA LX Equity""}}}"
security.models.Security;ALLIANZ SE-REG;Allianz SE;EUR;True;2020-01-01;;;;Bloomberg LP;ALV GY Equity;SECTYP_STOCK;;"{""aliases"": {""TELEKURS"": {""additional"": """", ""value"": ""322646.000""}, ""UBS"": {""additional"": """", ""value"": ""322646""}, ""FINALE"": {""additional"": ""For migration purpose"", ""value"": ""736714""}, ""BLOOMBERG"": {""additional"": """", ""value"": ""ALV GY Equity""}, ""ISIN"": {""additional"": """", ""value"": ""DE0008404005""}, ""LGT"": {""additional"": """", ""value"": ""322646""}}}"
security.models.Security;ALPHABET CL-A;ALPHABET CL-A;USD;True;2020-01-01;;;;Bloomberg LP;GOOGL US Equity;SECTYP_STOCK;;"{""aliases"": {""ISIN"": {""additional"": """", ""value"": ""US02079K3059""}, ""FINALE"": {""additional"": ""For migration purpose"", ""value"": ""125827""}, ""BLOOMBERG"": {""additional"": """", ""value"": ""GOOGL US Equity""}, ""UBS"": {""additional"": """", ""value"": ""29798540""}}}"
security.models.Security;ALPHABET INC-CL C;Alphabet Inc;USD;True;2020-01-01;;;;Bloomberg LP;GOOG US Equity;SECTYP_STOCK;;"{""aliases"": {""ISIN"": {""additional"": """", ""value"": ""US02079K1079""}, ""FINALE"": {""additional"": ""For migration purpose"", ""value"": ""612916""}, ""BLOOMBERG"": {""additional"": """", ""value"": ""GOOG US Equity""}, ""LGT"": {""additional"": """", ""value"": ""29798545""}}}"
security.models.Security;ALSTOM;Alstom SA;EUR;True;2020-01-01;;;;Bloomberg LP;ALO FP Equity;SECTYP_STOCK;;"{""aliases"": {""ISIN"": {""additional"": """", ""value"": ""FR0010220475""}, ""FINALE"": {""additional"": ""For migration purpose"", ""value"": ""6072430""}, ""BLOOMBERG"": {""additional"": """", ""value"": ""ALO FP Equity""}}}"
security.models.Security;ALTRIA GROUP INC 4%;ALTRIA GROUP INC 4% 31.01.24;USD;True;2013-10-31;2024-01-31;;;Bloomberg LP;EJ907393 Corp;SECTYP_BOND;;"{""aliases"": {""ISIN"": {""additional"": """", ""value"": ""US02209SAS23""}, ""FINALE"": {""additional"": ""For migration purpose"", ""value"": ""124605""}, ""BLOOMBERG"": {""additional"": """", ""value"": ""EJ907393 Corp""}}}"
security.models.Security;ALVOPETRO ENERGY LTD;ALVOPETRO ENERGY LTD;CAD;True;2020-01-01;;;;Bloomberg LP;ALV CV Equity;SECTYP_STOCK;;"{""aliases"": {""ISIN"": {""additional"": """", ""value"": ""CA02255Q1000""}, ""FINALE"": {""additional"": ""For migration purpose"", ""value"": ""124613""}, ""BLOOMBERG"": {""additional"": """", ""value"": ""ALV CV Equity""}}}"
security.models.Security;AMARA MINING PLC;AMARA MINING PLC;GBp;True;2020-01-01;;;;Bloomberg LP;AMA LN Equity;SECTYP_STOCK;;"{""aliases"": {""ISIN"": {""additional"": """", ""value"": ""GB00B04M1L91""}, ""FINALE"": {""additional"": ""For migration purpose"", ""value"": ""124617""}, ""BLOOMBERG"": {""additional"": """", ""value"": ""AMA LN Equity""}, ""UBS"": {""additional"": """", ""value"": ""2016598""}}}"
security.models.Security;AMAZON.COM INC;AMAZON.COM INC;USD;True;2020-01-01;;;;Bloomberg LP;AMZN US Equity;SECTYP_STOCK;;"{""aliases"": {""TELEKURS"": {""additional"": """", ""value"": ""645156.000""}, ""FINALE"": {""additional"": ""For migration purpose"", ""value"": ""124621""}, ""BLOOMBERG"": {""additional"": """", ""value"": ""AMZN US Equity""}, ""LGT"": {""additional"": """", ""value"": ""645156""}, ""ISIN"": {""additional"": """", ""value"": ""US0231351067""}}}"
security.models.Security;AMER TELNET CORP;AMER TELNET CORP;USD;True;2020-01-01;;;;Bloomberg LP;ATLN US Equity;SECTYP_STOCK;;"{""aliases"": {""ISIN"": {""additional"": """", ""value"": ""US0301881068""}, ""FINALE"": {""additional"": ""For migration purpose"", ""value"": ""124625""}, ""BLOOMBERG"": {""additional"": """", ""value"": ""ATLN US Equity""}}}"
security.models.Security;AMERICAN TOWER CORP 3.45%;AMERICAN TOWER CORP 3.45% 15.09.21;USD;True;2014-08-07;2021-09-15;;;Bloomberg LP;EK422199 Corp;SECTYP_BOND;;"{""aliases"": {""TELEKURS"": {""additional"": """", ""value"": ""25109437.000""}, ""FINALE"": {""additional"": ""For migration purpose"", ""value"": ""124629""}, ""BLOOMBERG"": {""additional"": """", ""value"": ""EK422199 Corp""}, ""ISIN"": {""additional"": """", ""value"": ""US03027XAE04""}}}"
security.models.Security;AMS AG;AMS AG;CHF;True;2020-01-01;;;;Bloomberg LP;AMS1 XS Equity;SECTYP_STOCK;;"{""aliases"": {""ISIN"": {""additional"": """", ""value"": ""AT0000A18XM4""}, ""FINALE"": {""additional"": ""For migration purpose"", ""value"": ""124633""}, ""BLOOMBERG"": {""additional"": """", ""value"": ""AMS1 XS Equity""}, ""LGT"": {""additional"": """", ""value"": ""24924656""}}}"
security.models.Security;AMUNDI-ABS VOL WLD EQY-AHEC;AMUNDI-ABS VOL WLD EQY-AHEC;EUR;True;2020-01-01;;;;Bloomberg LP;CAVMCC2 LX Equity;SECTYP_FUND;;"{""aliases"": {""ISIN"": {""additional"": """", ""value"": ""LU0442406889""}, ""FINALE"": {""additional"": ""For migration purpose"", ""value"": ""124637""}, ""BLOOMBERG"": {""additional"": """", ""value"": ""CAVMCC2 LX Equity""}}}"
security.models.Security;AMUNDI-ABS VOL WLD EQY-IHEC;AMUNDI-ABS VOL WLD EQY-IHEC;EUR;True;2020-01-01;;;;Bloomberg LP;AVWI10C LX Equity;SECTYP_FUND;;"{""aliases"": {""ISIN"": {""additional"": """", ""value"": ""LU0487547167""}, ""FINALE"": {""additional"": ""For migration purpose"", ""value"": ""124641""}, ""BLOOMBERG"": {""additional"": """", ""value"": ""AVWI10C LX Equity""}}}"
security.models.Security;AMUNDI-ABS VOL WLD EQY-IUC;AMUNDI-ABS VOL WLD EQY-IUC;USD;True;2020-01-01;;;;Bloomberg LP;CAMVWIA LX Equity;SECTYP_FUND;;"{""aliases"": {""ISIN"": {""additional"": """", ""value"": ""LU0319686829""}, ""FINALE"": {""additional"": ""For migration purpose"", ""value"": ""124645""}, ""BLOOMBERG"": {""additional"": """", ""value"": ""CAMVWIA LX Equity""}}}"
security.models.Security;AMUNDI-ABS VOL WLD EQY-IUC EUR;AMUNDI-ABS VOL WLD EQY-IUC EUR;EUR;True;2020-01-01;;;;FinaLE Engine;6035133;SECTYP_FUND;;"{""aliases"": {""FINALE"": {""additional"": ""For migration purpose"", ""value"": ""6035133""}}}"
security.models.Security;AMUNDI-ABS VOL WLD EQY-IUC EUR;AMUNDI-ABS VOL WLD EQY-IUC EUR;EUR;True;2020-01-01;;;;Swiss-Rev Guardian;132589;SECTYP_SECURITY;;"{""aliases"": {""FINALE"": {""additional"": ""For migration purpose"", ""value"": ""132589""}}}"
security.models.Security;AMUNDI-BD GL AGGREGATE-IUC;Amundi Funds - Bond Global Aggregate;USD;True;2020-01-01;;;;Bloomberg LP;CAMGAIA LX Equity;SECTYP_FUND;;"{""aliases"": {""ISIN"": {""additional"": """", ""value"": ""LU0319687637""}, ""FINALE"": {""additional"": ""For migration purpose"", ""value"": ""6364396""}, ""BLOOMBERG"": {""additional"": """", ""value"": ""CAMGAIA LX Equity""}}}"
security.models.Security;AMUNDI SA;Amundi SA;EUR;True;2020-01-01;;;;Bloomberg LP;AMUN FP Equity;SECTYP_STOCK;;"{""aliases"": {""ISIN"": {""additional"": """", ""value"": ""FR0004125920""}, ""FINALE"": {""additional"": ""For migration purpose"", ""value"": ""6368927""}, ""BLOOMBERG"": {""additional"": """", ""value"": ""AMUN FP Equity""}}}"
security.models.Security;ANDRITZ AG;ANDRITZ AG [ADRZF US];USD;True;2020-01-01;;;;Bloomberg LP;ADRZF US Equity;SECTYP_STOCK;;"{""aliases"": {""ISIN"": {""additional"": """", ""value"": ""AT0000730007""}, ""FINALE"": {""additional"": ""For migration purpose"", ""value"": ""1301651""}, ""BLOOMBERG"": {""additional"": """", ""value"": ""ADRZF US Equity""}}}"
security.models.Security;ANDRITZ AG;ANDRITZ AG [ANDR AV];EUR;True;2020-01-01;;;;Bloomberg LP;ANDR AV Equity;SECTYP_STOCK;;"{""aliases"": {""ISIN"": {""additional"": """", ""value"": ""AT0000730007""}, ""FINALE"": {""additional"": ""For migration purpose"", ""value"": ""1301655""}, ""BLOOMBERG"": {""additional"": """", ""value"": ""ANDR AV Equity""}}}"
security.models.Security;ANDRITZ AG;ANDRITZ AG [ANDR EB];EUR;True;2020-01-01;;;;Bloomberg LP;ANDR EB Equity;SECTYP_STOCK;;"{""aliases"": {""ISIN"": {""additional"": """", ""value"": ""AT0000730007""}, ""FINALE"": {""additional"": ""For migration purpose"", ""value"": ""1301659""}, ""BLOOMBERG"": {""additional"": """", ""value"": ""ANDR EB Equity""}}}"
security.models.Security;ANDRITZ AG;ANDRITZ AG [ANDR EO];EUR;True;2020-01-01;;;;Bloomberg LP;ANDR EO Equity;SECTYP_STOCK;;"{""aliases"": {""ISIN"": {""additional"": """", ""value"": ""AT0000730007""}, ""FINALE"": {""additional"": ""For migration purpose"", ""value"": ""1301663""}, ""BLOOMBERG"": {""additional"": """", ""value"": ""ANDR EO Equity""}}}"
security.models.Security;ANDRITZ AG;ANDRITZ AG [ANDR EU];EUR;True;2020-01-01;;;;Bloomberg LP;ANDR EU Equity;SECTYP_STOCK;;"{""aliases"": {""ISIN"": {""additional"": """", ""value"": ""AT0000730007""}, ""FINALE"": {""additional"": ""For migration purpose"", ""value"": ""1301667""}, ""BLOOMBERG"": {""additional"": """", ""value"": ""ANDR EU Equity""}}}"
security.models.Security;ANDRITZ AG;ANDRITZ AG [ANDR GK];EUR;True;2020-01-01;;;;Bloomberg LP;ANDR GK Equity;SECTYP_STOCK;;"{""aliases"": {""ISIN"": {""additional"": """", ""value"": ""AT0000730007""}, ""FINALE"": {""additional"": ""For migration purpose"", ""value"": ""1301671""}, ""BLOOMBERG"": {""additional"": """", ""value"": ""ANDR GK Equity""}}}"
security.models.Security;ANDRITZ AG;ANDRITZ AG [ANDR IX];EUR;True;2020-01-01;;;;Bloomberg LP;ANDR IX Equity;SECTYP_STOCK;;"{""aliases"": {""ISIN"": {""additional"": """", ""value"": ""AT0000730007""}, ""FINALE"": {""additional"": ""For migration purpose"", ""value"": ""1301675""}, ""BLOOMBERG"": {""additional"": """", ""value"": ""ANDR IX Equity""}}}"
security.models.Security;ANDRITZ AG;ANDRITZ AG [ANDR LI];EUR;True;2020-01-01;;;;Bloomberg LP;ANDR LI Equity;SECTYP_STOCK;;"{""aliases"": {""ISIN"": {""additional"": """", ""value"": ""AT0000730007""}, ""FINALE"": {""additional"": ""For migration purpose"", ""value"": ""1301679""}, ""BLOOMBERG"": {""additional"": """", ""value"": ""ANDR LI Equity""}}}"
security.models.Security;ANDRITZ AG;ANDRITZ AG [ANDR NQ];EUR;True;2020-01-01;;;;Bloomberg LP;ANDR NQ Equity;SECTYP_STOCK;;"{""aliases"": {""ISIN"": {""additional"": """", ""value"": ""AT0000730007""}, ""FINALE"": {""additional"": ""For migration purpose"", ""value"": ""1301683""}, ""BLOOMBERG"": {""additional"": """", ""value"": ""ANDR NQ Equity""}}}"
security.models.Security;ANDRITZ AG;ANDRITZ AG [ANDR NR];EUR;True;2020-01-01;;;;Bloomberg LP;ANDR NR Equity;SECTYP_STOCK;;"{""aliases"": {""ISIN"": {""additional"": """", ""value"": ""AT0000730007""}, ""FINALE"": {""additional"": ""For migration purpose"", ""value"": ""1301687""}, ""BLOOMBERG"": {""additional"": """", ""value"": ""ANDR NR Equity""}}}"
security.models.Security;ANDRITZ AG;ANDRITZ AG [ANDR PZ];EUR;True;2020-01-01;;;;Bloomberg LP;ANDR PZ Equity;SECTYP_STOCK;;"{""aliases"": {""ISIN"": {""additional"": """", ""value"": ""AT0000730007""}, ""FINALE"": {""additional"": ""For migration purpose"", ""value"": ""1301691""}, ""BLOOMBERG"": {""additional"": """", ""value"": ""ANDR PZ Equity""}}}"
security.models.Security;ANDRITZ AG;ANDRITZ AG [ANDR QM];EUR;True;2020-01-01;;;;Bloomberg LP;ANDR QM Equity;SECTYP_STOCK;;"{""aliases"": {""ISIN"": {""additional"": """", ""value"": ""AT0000730007""}, ""FINALE"": {""additional"": ""For migration purpose"", ""value"": ""1301695""}, ""BLOOMBERG"": {""additional"": """", ""value"": ""ANDR QM Equity""}}}"
security.models.Security;ANDRITZ AG;ANDRITZ AG [ANDR S1];EUR;True;2020-01-01;;;;Bloomberg LP;ANDR S1 Equity;SECTYP_STOCK;;"{""aliases"": {""ISIN"": {""additional"": """", ""value"": ""AT0000730007""}, ""FINALE"": {""additional"": ""For migration purpose"", ""value"": ""1301699""}, ""BLOOMBERG"": {""additional"": """", ""value"": ""ANDR S1 Equity""}}}"
security.models.Security;ANDRITZ AG;ANDRITZ AG [ANDR SW];CHF;True;2020-01-01;;;;Bloomberg LP;ANDR SW Equity;SECTYP_STOCK;;"{""aliases"": {""ISIN"": {""additional"": """", ""value"": ""AT0000730007""}, ""FINALE"": {""additional"": ""For migration purpose"", ""value"": ""1301703""}, ""BLOOMBERG"": {""additional"": """", ""value"": ""ANDR SW Equity""}}}"
security.models.Security;ANDRITZ AG;ANDRITZ AG [ANDR TQ];EUR;True;2020-01-01;;;;Bloomberg LP;ANDR TQ Equity;SECTYP_STOCK;;"{""aliases"": {""ISIN"": {""additional"": """", ""value"": ""AT0000730007""}, ""FINALE"": {""additional"": ""For migration purpose"", ""value"": ""1301707""}, ""BLOOMBERG"": {""additional"": """", ""value"": ""ANDR TQ Equity""}}}"
security.models.Security;ANDRITZ AG;ANDRITZ AG [ANDRCHF EO];CHF;True;2020-01-01;;;;Bloomberg LP;ANDRCHF EO Equity;SECTYP_STOCK;;"{""aliases"": {""ISIN"": {""additional"": """", ""value"": ""AT0000730007""}, ""FINALE"": {""additional"": ""For migration purpose"", ""value"": ""1301711""}, ""BLOOMBERG"": {""additional"": """", ""value"": ""ANDRCHF EO Equity""}}}"
security.models.Security;ANDRITZ AG;ANDRITZ AG [ANDRCHF EU];CHF;True;2020-01-01;;;;Bloomberg LP;ANDRCHF EU Equity;SECTYP_STOCK;;"{""aliases"": {""ISIN"": {""additional"": """", ""value"": ""AT0000730007""}, ""FINALE"": {""additional"": ""For migration purpose"", ""value"": ""1301715""}, ""BLOOMBERG"": {""additional"": """", ""value"": ""ANDRCHF EU Equity""}}}"
security.models.Security;ANDRITZ AG;ANDRITZ AG [ANDRGBP EO];GBP;True;2020-01-01;;;;Bloomberg LP;ANDRGBP EO Equity;SECTYP_STOCK;;"{""aliases"": {""ISIN"": {""additional"": """", ""value"": ""AT0000730007""}, ""FINALE"": {""additional"": ""For migration purpose"", ""value"": ""1301719""}, ""BLOOMBERG"": {""additional"": """", ""value"": ""ANDRGBP EO Equity""}}}"
security.models.Security;ANDRITZ AG;ANDRITZ AG [ANDRGBX EO];GBp;True;2020-01-01;;;;Bloomberg LP;ANDRGBX EO Equity;SECTYP_STOCK;;"{""aliases"": {""ISIN"": {""additional"": """", ""value"": ""AT0000730007""}, ""FINALE"": {""additional"": ""For migration purpose"", ""value"": ""1301723""}, ""BLOOMBERG"": {""additional"": """", ""value"": ""ANDRGBX EO Equity""}}}"
security.models.Security;ANDRITZ AG;ANDRITZ AG [ANDRGBX EU];GBp;True;2020-01-01;;;;Bloomberg LP;ANDRGBX EU Equity;SECTYP_STOCK;;"{""aliases"": {""ISIN"": {""additional"": """", ""value"": ""AT0000730007""}, ""FINALE"": {""additional"": ""For migration purpose"", ""value"": ""1301727""}, ""BLOOMBERG"": {""additional"": """", ""value"": ""ANDRGBX EU Equity""}}}"
security.models.Security;ANDRITZ AG;ANDRITZ AG [ANDRUSD EO];USD;True;2020-01-01;;;;Bloomberg LP;ANDRUSD EO Equity;SECTYP_STOCK;;"{""aliases"": {""ISIN"": {""additional"": """", ""value"": ""AT0000730007""}, ""FINALE"": {""additional"": ""For migration purpose"", ""value"": ""1301731""}, ""BLOOMBERG"": {""additional"": """", ""value"": ""ANDRUSD EO Equity""}}}"
security.models.Security;ANDRITZ AG;ANDRITZ AG [ANDRV B3];EUR;True;2020-01-01;;;;Bloomberg LP;ANDRV B3 Equity;SECTYP_STOCK;;"{""aliases"": {""ISIN"": {""additional"": """", ""value"": ""AT0000730007""}, ""FINALE"": {""additional"": ""For migration purpose"", ""value"": ""1301735""}, ""BLOOMBERG"": {""additional"": """", ""value"": ""ANDRV B3 Equity""}}}"
security.models.Security;ANDRITZ AG;ANDRITZ AG [ANDRV L3];EUR;True;2020-01-01;;;;Bloomberg LP;ANDRV L3 Equity;SECTYP_STOCK;;"{""aliases"": {""ISIN"": {""additional"": """", ""value"": ""AT0000730007""}, ""FINALE"": {""additional"": ""For migration purpose"", ""value"": ""1301739""}, ""BLOOMBERG"": {""additional"": """", ""value"": ""ANDRV L3 Equity""}}}"
security.models.Security;ANDRITZ AG;ANDRITZ AG [ANDRV PO];EUR;True;2020-01-01;;;;Bloomberg LP;ANDRV PO Equity;SECTYP_STOCK;;"{""aliases"": {""ISIN"": {""additional"": """", ""value"": ""AT0000730007""}, ""FINALE"": {""additional"": ""For migration purpose"", ""value"": ""1301743""}, ""BLOOMBERG"": {""additional"": """", ""value"": ""ANDRV PO Equity""}}}"
security.models.Security;ANDRITZ AG;ANDRITZ AG [ANDRV S2];EUR;True;2020-01-01;;;;Bloomberg LP;ANDRV S2 Equity;SECTYP_STOCK;;"{""aliases"": {""ISIN"": {""additional"": """", ""value"": ""AT0000730007""}, ""FINALE"": {""additional"": ""For migration purpose"", ""value"": ""1301747""}, ""BLOOMBERG"": {""additional"": """", ""value"": ""ANDRV S2 Equity""}}}"
security.models.Security;ANDRITZ AG;ANDRITZ AG [AZ2 GR];EUR;True;2020-01-01;;;;Bloomberg LP;AZ2 GR Equity;SECTYP_STOCK;;"{""aliases"": {""ISIN"": {""additional"": """", ""value"": ""AT0000730007""}, ""FINALE"": {""additional"": ""For migration purpose"", ""value"": ""1301751""}, ""BLOOMBERG"": {""additional"": """", ""value"": ""AZ2 GR Equity""}}}"
security.models.Security;ANDRITZ AG;ANDRITZ AG [AZ2 QT];EUR;True;2020-01-01;;;;Bloomberg LP;AZ2 QT Equity;SECTYP_STOCK;;"{""aliases"": {""ISIN"": {""additional"": """", ""value"": ""AT0000730007""}, ""FINALE"": {""additional"": ""For migration purpose"", ""value"": ""1301755""}, ""BLOOMBERG"": {""additional"": """", ""value"": ""AZ2 QT Equity""}}}"
security.models.Security;ANDRITZ AG;ANDRITZ AG [AZ2 TH];EUR;True;2020-01-01;;;;Bloomberg LP;AZ2 TH Equity;SECTYP_STOCK;;"{""aliases"": {""ISIN"": {""additional"": """", ""value"": ""AT0000730007""}, ""FINALE"": {""additional"": ""For migration purpose"", ""value"": ""1301759""}, ""BLOOMBERG"": {""additional"": """", ""value"": ""AZ2 TH Equity""}}}"
security.models.Security;ANDRITZ AG;ANDRITZ AG [AZZG IX];EUR;True;2020-01-01;;;;Bloomberg LP;AZZG IX Equity;SECTYP_STOCK;;"{""aliases"": {""ISIN"": {""additional"": """", ""value"": ""AT0000730007""}, ""FINALE"": {""additional"": ""For migration purpose"", ""value"": ""1301763""}, ""BLOOMBERG"": {""additional"": """", ""value"": ""AZZG IX Equity""}}}"
security.models.Security;ANGLO AMERICAN CAPITAL 4.125%;ANGLO AMERICAN CAPITAL 4.125% 27.09.22;USD;True;2012-09-27;2022-09-27;;;Bloomberg LP;EJ375249 Corp;SECTYP_BOND;;"{""aliases"": {""ISIN"": {""additional"": """", ""value"": ""USG03762CH52""}, ""FINALE"": {""additional"": ""For migration purpose"", ""value"": ""124651""}, ""BLOOMBERG"": {""additional"": """", ""value"": ""EJ375249 Corp""}}}"
security.models.Security;ANGLO AMERICAN CAPITAL 5.75%;ANGLO AMERICAN CAPITAL 5.75% 27.11.18;AUD;True;2013-11-27;2018-11-27;;;Bloomberg LP;EJ949188 Corp;SECTYP_BOND;;"{""aliases"": {""ISIN"": {""additional"": """", ""value"": ""AU0000AQMHA7""}, ""FINALE"": {""additional"": ""For migration purpose"", ""value"": ""6035138""}, ""BLOOMBERG"": {""additional"": """", ""value"": ""EJ949188 Corp""}}}"
security.models.Security;ANGLOGOLD HOLDINGS PLC 5.375%;ANGLOGOLD HOLDINGS PLC 5.375% 15.04.20;USD;True;2010-04-28;2020-04-15;;;Bloomberg LP;EI231206 Corp;SECTYP_BOND;;"{""aliases"": {""TELEKURS"": {""additional"": """", ""value"": ""11248300.000""}, ""UBS"": {""additional"": """", ""value"": ""11248300""}, ""FINALE"": {""additional"": ""For migration purpose"", ""value"": ""124655""}, ""BLOOMBERG"": {""additional"": """", ""value"": ""EI231206 Corp""}, ""ISIN"": {""additional"": """", ""value"": ""US03512TAA97""}, ""LGT"": {""additional"": """", ""value"": ""11248300""}}}"
security.models.Security;ANHEUSER-BUSCH INBEV SA/NV;Anheuser-Busch InBev SA/NV;USD;True;2020-01-01;;;;Bloomberg LP;BUDFF US Equity;SECTYP_STOCK;;"{""aliases"": {""ISIN"": {""additional"": """", ""value"": ""BE0974293251""}, ""FINALE"": {""additional"": ""For migration purpose"", ""value"": ""6994887""}, ""BLOOMBERG"": {""additional"": """", ""value"": ""BUDFF US Equity""}}}"
security.models.Security;ANHEUSER-BUSCH INBEV SA/NV;Anheuser-Busch InBev SA/NV [ABI BB];EUR;True;2020-01-01;;;;Bloomberg LP;ABI BB Equity;SECTYP_STOCK;;"{""aliases"": {""ISIN"": {""additional"": """", ""value"": ""BE0974293251""}, ""FINALE"": {""additional"": ""For migration purpose"", ""value"": ""7434513""}, ""BLOOMBERG"": {""additional"": """", ""value"": ""ABI BB Equity""}, ""LGT"": {""additional"": """", ""value"": ""34149140""}}}"
security.models.Security;APACHE CORP;APACHE CORP;USD;True;2020-01-01;;;;Bloomberg LP;APA US Equity;SECTYP_STOCK;;"{""aliases"": {""ISIN"": {""additional"": """", ""value"": ""US0374111054""}, ""FINALE"": {""additional"": ""For migration purpose"", ""value"": ""124663""}, ""BLOOMBERG"": {""additional"": """", ""value"": ""APA US Equity""}}}"
security.models.Security;APOLLO ENTERPRISE SOLUTION;APOLLO ENTERPRISE SOLUTION;EUR;True;2020-01-01;;;;Bloomberg LP;OAL GR Equity;SECTYP_STOCK;;"{""aliases"": {""ISIN"": {""additional"": """", ""value"": ""BMG0410V2071""}, ""FINALE"": {""additional"": ""For migration purpose"", ""value"": ""124667""}, ""BLOOMBERG"": {""additional"": """", ""value"": ""OAL GR Equity""}}}"
security.models.Security;APPLE INC;APPLE INC;USD;True;2020-01-01;;;;Bloomberg LP;AAPL UQ Equity;SECTYP_STOCK;;"{""aliases"": {""TELEKURS"": {""additional"": """", ""value"": ""908440.000""}, ""UBS"": {""additional"": """", ""value"": ""908440""}, ""FINALE"": {""additional"": ""For migration purpose"", ""value"": ""124671""}, ""BLOOMBERG"": {""additional"": """", ""value"": ""AAPL UQ Equity""}, ""ISIN"": {""additional"": """", ""value"": ""US0378331005""}, ""LGT"": {""additional"": """", ""value"": ""908440""}}}"
security.models.Security;CITIGRP-CW16 APPLE INC;Apple Inc [5716C FP];EUR;True;2020-01-01;;;;Bloomberg LP;5716C FP Equity;SECTYP_STOCK;;"{""aliases"": {""ISIN"": {""additional"": """", ""value"": ""DE000CW40X13""}, ""FINALE"": {""additional"": ""For migration purpose"", ""value"": ""1088467""}, ""BLOOMBERG"": {""additional"": """", ""value"": ""5716C FP Equity""}}}"
security.models.Security;APPLE INC 1%;APPLE INC 1% 03.05.18;USD;True;2013-05-03;2018-05-03;;;Bloomberg LP;EJ659243 Corp;SECTYP_BOND;;"{""aliases"": {""ISIN"": {""additional"": """", ""value"": ""US037833AJ95""}, ""FINALE"": {""additional"": ""For migration purpose"", ""value"": ""124675""}, ""BLOOMBERG"": {""additional"": """", ""value"": ""EJ659243 Corp""}, ""LGT"": {""additional"": """", ""value"": ""21311603""}}}"
security.models.Security;APPLE INC;APPLE INC 2.25% 2021-02-23;USD;True;2020-01-01;2021-02-23;;;Bloomberg LP;US037833BS85;SECTYP_BOND;;"{""aliases"": {""ISIN"": {""additional"": """", ""value"": ""US037833BS85""}, ""FINALE"": {""additional"": ""For migration purpose"", ""value"": ""6369529""}, ""BLOOMBERG"": {""additional"": """", ""value"": ""US037833BS85""}, ""LGT"": {""additional"": """", ""value"": ""31618396""}}}"
security.models.Security;APPLE INC 2.4% 03.05.23;APPLE INC 2.4% 03.05.23;USD;True;2013-05-03;2023-05-03;;;Bloomberg LP;EJ659248 Corp;SECTYP_BOND;;"{""aliases"": {""ISIN"": {""additional"": """", ""value"": ""US037833AK68""}, ""FINALE"": {""additional"": ""For migration purpose"", ""value"": ""1303684""}, ""BLOOMBERG"": {""additional"": """", ""value"": ""EJ659248 Corp""}}}"
security.models.Security;APPLE INC;APPLE INC 2.5% 2022-02-09;USD;True;2020-01-01;2022-02-09;;;Bloomberg LP;US037833CM07;SECTYP_BOND;;"{""aliases"": {""ISIN"": {""additional"": """", ""value"": ""US037833CM07""}, ""FINALE"": {""additional"": ""For migration purpose"", ""value"": ""6425054""}, ""BLOOMBERG"": {""additional"": """", ""value"": ""US037833CM07""}, ""LGT"": {""additional"": """", ""value"": ""35604991""}, ""UBS"": {""additional"": """", ""value"": ""35604991""}}}"
security.models.Security;April 17 Calls on ROG VX;April 17 Calls on ROG VX;CHF;True;2020-01-01;;;;Bloomberg LP;ROG SW 04/21/17 C240 Equity;SECTYP_SECURITY;;"{""aliases"": {""FINALE"": {""additional"": ""For migration purpose"", ""value"": ""6425569""}, ""BLOOMBERG"": {""additional"": """", ""value"": ""ROG SW 04/21/17 C240 Equity""}}}"
security.models.Security;AQUILA RESOURCES LTD;AQUILA RESOURCES LTD;AUD;True;2020-01-01;;;;Bloomberg LP;AQA AU Equity;SECTYP_STOCK;;"{""aliases"": {""ISIN"": {""additional"": """", ""value"": ""AU000000AQA9""}, ""FINALE"": {""additional"": ""For migration purpose"", ""value"": ""124679""}, ""BLOOMBERG"": {""additional"": """", ""value"": ""AQA AU Equity""}}}"
security.models.Security;ARCANO-EUROP.INCOME FD I BA - TO RECEIVE;ARCANO-EUROP.INCOME FD I BA - TO RECEIVE;EUR;True;2020-01-01;;;;Swiss-Rev Guardian;132600;SECTYP_FUND;;"{""aliases"": {""ISIN"": {""additional"": """", ""value"": ""ZZ00AA9KS4 0""}, ""FINALE"": {""additional"": ""For migration purpose"", ""value"": ""132600""}}}"
security.models.Security;ARCANO EUROPEAN INCOME I-IAA;ARCANO EUROPEAN INCOME I-IAA [AREIIAA LX];EUR;True;2020-01-01;;;;Bloomberg LP;AREIIAA LX Equity;SECTYP_FUND;;"{""aliases"": {""ISIN"": {""additional"": """", ""value"": ""LU0646913847""}, ""FINALE"": {""additional"": ""For migration purpose"", ""value"": ""6035150""}, ""BLOOMBERG"": {""additional"": """", ""value"": ""AREIIAA LX Equity""}}}"
security.models.Security;ARCANO EUROPEAN INCOME I-IBA;ARCANO EUROPEAN INCOME I-IBA;EUR;True;2020-01-01;;;;Bloomberg LP;AREIIBA LX Equity;SECTYP_FUND;;"{""aliases"": {""ISIN"": {""additional"": """", ""value"": ""LU0646914142""}, ""FINALE"": {""additional"": ""For migration purpose"", ""value"": ""124683""}, ""BLOOMBERG"": {""additional"": """", ""value"": ""AREIIBA LX Equity""}}}"
security.models.Security;ARCELORMITTAL;ARCELORMITTAL;EUR;True;2020-01-01;;;;Bloomberg LP;MT NA Equity;SECTYP_STOCK;;"{""aliases"": {""ISIN"": {""additional"": """", ""value"": ""LU0323134006""}, ""FINALE"": {""additional"": ""For migration purpose"", ""value"": ""124690""}, ""BLOOMBERG"": {""additional"": """", ""value"": ""MT NA Equity""}}}"
